user_input,retrieved_contexts,response,faithfulness
What is the purpose of the Privacy Act of 1974?,"['10 - The Privacy Act of 1974 (Rev. 1, 09-11-02) A. General The purpose of the Privacy Act of 1974 is to provide safeguards for individuals against an invasion of privacy by Federal agencies. Among other things, Federal agencies are required to permit an individual to: • Determine what records pertaining to the individual are collected, used, or disseminated by such agencies; • Prevent records pertaining to the individual obtained by Federal agencies for a specific purpose from being used for another purpose without the individual\'s consent; and • Gain access to information pertaining to the individual in Federal agency records, and to correct such records when appropriate. Contractors considered to be Federal agencies for purposes of administering the Privacy Act must comply with its provisions. Contractors must: • Inform each individual from whom information is requested of their rights under the Privacy Act; • Describe the method of accessing an individual\'s records; • Prepare a method of accounting for disclosures; and • Devise a method of reviewing records at the request of individuals and making corrections if appropriate. Additional information concerning Medicare privacy policies can be accessed on the CMS Web site under the Privacy Policy link at the bottom of the web page. B. Definition of ""Individual"" ""Individual"" means a living person on whom CMS has any personal (as opposed to business) information. ""Individual"" does not include so-called persons such as sole', 'compatible with the purpose for which the information was collected in the first place. An explanation of the purposes and uses of each ""routine use"" disclosure must be published in the Federal Register at least 30 days prior to the disclosure and at least annually thereafter. Current routine uses are: • Part B Payment Records • Payment Record Reference File • Tape containing amount, type, and cost of health care services. • Summary Records • Group Health Plan Membership Data • Identification Data • Group Health Membership Data • Group Health Membership List • Quality Assurance Program Releases and Corrections M. Accounting for Disclosure The Privacy Act requires that agencies account for disclosures of personal data to organizations outside DHHS or made in response to requests under the FOIA. The purposes of the accounting are: • To allow individuals to learn to whom records about themselves have been disclosed; and • To provide a basis for subsequently advising recipients of any amended or disputed records. The accounting must enable the contractor to tell the individual when and what information about the individual was released and to whom. It is not necessary to maintain a separate record of disclosures if such information can be retrieved from the contractor\'s operating records. An individual has the same access rights to an accounting of disclosures as to other information, with no exception. It is not mandatory to tell an individual about disclosures made to an agency', ""the Privacy Act (5U.S.C. §552a) precludes release of those records except pursuant to a written authorization to release signed by the subject(s) of the records or unless the Freedom of Information Act requires release of the records or a court of competent jurisdiction orders release. Regarding the latter condition of disclosure, for purposes of the Privacy Act, a court of competent jurisdiction is a Federal court only. Review of this matter indicates that your firm has not presented a written authorization to release records signed by the subject(s) of the records. Moreover, your firm's subpoena is not an order of a court of competent jurisdiction, and 45"", ""C. Physicians' and Suppliers' Rights to Access Under the Privacy Act Providers, physicians, and suppliers as business entities do not have access to business information about themselves under the Privacy Act, since the Privacy Act concerns individuals only. However, a physician or other supplier who is also an individual has the same access rights as any other individual to personal information maintained about themselves. Purely business information which is retrievable by the physician's unique identifier is not subject to the Privacy Act, but it may be disclosed to the physician to the extent that we would not deny the physician the information under the Freedom of Information Act (FOIA). D. Informing Individuals of Rights The contractor must inform the individual of his/her rights under the Privacy Act when it solicits any information directly from the beneficiary in connection with a Medicare claim. This would usually be a result of the failure of the individual or provider to furnish all the information required on a claims form. When information is collected by telephone, the contractor will give the individual a brief oral explanation. When information is requested by mail a written notice is used. E. Method of Accessing Individual Records - General The law requires that an agency must inform an individual, upon request, whether a system of records contains a record pertaining to the individual, permit the individual to review such record and to be accompanied for"", 'individual\'s request to amend a record, the contractor should, whenever practicable, complete the review and advise the individual of the results within 10 days of the receipt of the request. Prompt action should be taken wherever possible to reduce the administrative costs involved in issuing both a separate acknowledgment of the receipt of the request and a subsequent notice informing the individual of the action taken. If a contractor denies a request for correction, the individual can appeal to the system manager for the contractor\'s system of records. O. Penalties All employees must be aware of their responsibilities under the Privacy Act and guard against improper disclosure of personal information. Any officer or employee who willfully discloses individually identifiable information, the disclosure of which is prohibited by the Act, shall be guilty of a misdemeanor and fined not more than $5,000. P. Providers, Physicians, Suppliers, and the Privacy Act: 1. Confidentiality of Provider and Supplier Records Medicare information may not be accepted from providers, physicians, and other suppliers of services on a confidential basis, expressed or implied, since any medical information obtained by a contractor is subject to disclosure to the individual to whom it pertains. Contractors are to make sure their providers and other suppliers of services are aware that no medical information marked ""confidential"" will be accepted on that basis and that any medical information', 'transactions. At the same time, Congress recognized that advances in electronic technology could erode the privacy of health information. Consequently, Congress incorporated into HIPAA provisions that mandated the adoption of Federal privacy protections for individually identifiable health information. The Department of Health and Human Services issued the regulation “Standards for Privacy of Individually Identifiable Health Information”, 45 CFR Parts 160 and 164, (the HIPAA Privacy Rule) to implement section 264 of HIPAA. The HIPAA Privacy Rule establishes a set of basic national privacy standards and fair information practices. It sets a floor of ground rules for health care providers, health plans, and health care clearinghouses to follow to protect the privacy of an individual’s personal health information. The HIPAA Privacy Rule is based on the same fair information principles that are found in the Privacy Act of 1974 and are now generally extended to the public and private sectors of the health care delivery system. The HIPAA Privacy Rule applies to protected health information (PHI) held by covered entities, as defined by the Rule, while the Privacy Act protects records with individually identifiable information held by Federal agencies. The Privacy Act continues to apply to Medicare and Medicare fee-for-service (FFS) contractors in their day-to-day operations.', ""Without Consent, information may not be disclosed without the written consent of the subject individual, or their legal guardian, or, in the case of a minor, their parent (a parent or legal guardian of a minor may not consent to the disclosure of medical information about the minor). Other persons, regardless of relationship (except members of Congress and representative payees), may not receive information about the individual without their consent. In addition, a person who receives information about an individual with the individual's consent may not authorize disclosure of that information to someone else. Awkward situations may develop from a refusal, in compliance with the Privacy Act, to divulge information to the child or spouse of an aged or infirm individual. In order to avoid lengthy and unproductive correspondence, the requester should be advised that the Privacy Act precludes our disclosing any information to anyone other than the individual to whom the information pertains without the specific written consent of that individual, but that the requested information will be sent directly to the individual concerned with an explanation of the inquiry received on their behalf. J. Disclosures to Members of Congress Information requested by members of Congress and their staffs may be disclosed as follows: • Where a member of Congress (or a staff member) inquires on behalf of a constituent, the contractor may respond to the member of Congress (MC) without the written"", 'be permitted for Medicare. Similarly, if the disclosure is a “routine use” under the Privacy Act, but the HIPAA Privacy Rule prohibits the disclosure, CMS will not make the disclosure. Exemption 6 of the Freedom of Information Act (FOIA) permits Federal agencies to withhold personnel and medical files the disclosure of which would constitute a clearly unwarranted invasion of personal privacy. When a FOIA request asks for documents that include personal information, CMS must apply Exemption 6 to preclude the release of, or must otherwise redact, identifying details before disclosing the remaining information. 2. Information About Deceased Individuals The application of Exemption 6 of the FOIA to information about deceased individuals requires a different analysis than that applicable to living individuals because under the Privacy Act of 1974, privacy rights are extinguished at death. However, under FOIA, it is entirely appropriate to consider the privacy interest of a decedent’s survivors under Exemption 6. Under the HIPAA Privacy Rule, the personal health information of deceased as well as living persons is protected. 3. Requests for Access to Records The FOIA and Privacy Act requests will continue to be handled according to current procedures and timeliness standards. A FOIA request for access to public records requires CMS, as a Federal agency, to provide the fullest possible disclosure of its records to the public, subject to certain exceptions (e.g., proprietary', 'survivors under Exemption 6. Under the HIPAA Privacy Rule, the personal health information of deceased as well as living persons is protected. 3. Requests for Access to Records The FOIA and Privacy Act requests will continue to be handled according to current procedures and timeliness standards. A FOIA request for access to public records requires CMS, as a Federal agency, to provide the fullest possible disclosure of its records to the public, subject to certain exceptions (e.g., proprietary information, national defense risks). The Privacy Act requires CMS to provide individuals access to their personal information maintained in a System of Records. Note that an individual’s request under the Privacy Act to access his or her records must specify a', 'by the provisions of § 1106 if the Social Security Act as implemented by Regulation No. 1, the Privacy Act, the FOI Act, and the DHHS Public Information Regulation. 40.1 - Prohibition Against Disclosure (Rev. 1, 09-11-02) Section 1106 of the Social Security Act prohibits disclosure of any file, record, report, or other paper, or any information obtained at any time by the Secretary or an officer or employee of DHHS in the course of discharging their duties under the Act, except as prescribed by regulations. Where manual instructions permit disclosure, assume that related regulations have been published. The same prohibition applies to information received by any person outside DHHS, from the Secretary, or an officer or employee of DHHS. The prohibition applies to any agency, organization (e.g., contractors), or institution, or any of its officers or employees, in the fulfillment of a contract or agreement with the Secretary. A. Disclosure of Provider or Physician Records The prohibition also relates to any information received from DHHS, a contractor, or any person or entity that furnishes services under arrangements with a provider or accepts an assignment under the program. However, patient records in the possession of a provider']","The purpose of the Privacy Act of 1974 is to provide safeguards for individuals against an invasion of privacy by Federal agencies. It requires Federal agencies to allow individuals to:

- Determine what records pertaining to them are collected, used, or disseminated by such agencies;
- Prevent records obtained for a specific purpose from being used for another purpose without the individual's consent; and
- Gain access to information about themselves in Federal agency records and to correct such records when appropriate.",1.0
Who is considered an individual under the Privacy Act?,"['10 - The Privacy Act of 1974 (Rev. 1, 09-11-02) A. General The purpose of the Privacy Act of 1974 is to provide safeguards for individuals against an invasion of privacy by Federal agencies. Among other things, Federal agencies are required to permit an individual to: • Determine what records pertaining to the individual are collected, used, or disseminated by such agencies; • Prevent records pertaining to the individual obtained by Federal agencies for a specific purpose from being used for another purpose without the individual\'s consent; and • Gain access to information pertaining to the individual in Federal agency records, and to correct such records when appropriate. Contractors considered to be Federal agencies for purposes of administering the Privacy Act must comply with its provisions. Contractors must: • Inform each individual from whom information is requested of their rights under the Privacy Act; • Describe the method of accessing an individual\'s records; • Prepare a method of accounting for disclosures; and • Devise a method of reviewing records at the request of individuals and making corrections if appropriate. Additional information concerning Medicare privacy policies can be accessed on the CMS Web site under the Privacy Policy link at the bottom of the web page. B. Definition of ""Individual"" ""Individual"" means a living person on whom CMS has any personal (as opposed to business) information. ""Individual"" does not include so-called persons such as sole', 'method of accounting for disclosures; and • Devise a method of reviewing records at the request of individuals and making corrections if appropriate. Additional information concerning Medicare privacy policies can be accessed on the CMS Web site under the Privacy Policy link at the bottom of the web page. B. Definition of ""Individual"" ""Individual"" means a living person on whom CMS has any personal (as opposed to business) information. ""Individual"" does not include so-called persons such as sole proprietorships, partnerships, or corporations. Except for disclosure of and access to medical information about minors, a parent or legal guardian of a minor, or a legal guardian of someone the court has declared incompetent, has the same rights as the individual to the individual\'s records. No one may act on behalf of an individual who has not been declared incompetent by a court or gain access to his/her records under the Privacy Act without the individual\'s written consent.', ""C. Physicians' and Suppliers' Rights to Access Under the Privacy Act Providers, physicians, and suppliers as business entities do not have access to business information about themselves under the Privacy Act, since the Privacy Act concerns individuals only. However, a physician or other supplier who is also an individual has the same access rights as any other individual to personal information maintained about themselves. Purely business information which is retrievable by the physician's unique identifier is not subject to the Privacy Act, but it may be disclosed to the physician to the extent that we would not deny the physician the information under the Freedom of Information Act (FOIA). D. Informing Individuals of Rights The contractor must inform the individual of his/her rights under the Privacy Act when it solicits any information directly from the beneficiary in connection with a Medicare claim. This would usually be a result of the failure of the individual or provider to furnish all the information required on a claims form. When information is collected by telephone, the contractor will give the individual a brief oral explanation. When information is requested by mail a written notice is used. E. Method of Accessing Individual Records - General The law requires that an agency must inform an individual, upon request, whether a system of records contains a record pertaining to the individual, permit the individual to review such record and to be accompanied for"", 'individual\'s request to amend a record, the contractor should, whenever practicable, complete the review and advise the individual of the results within 10 days of the receipt of the request. Prompt action should be taken wherever possible to reduce the administrative costs involved in issuing both a separate acknowledgment of the receipt of the request and a subsequent notice informing the individual of the action taken. If a contractor denies a request for correction, the individual can appeal to the system manager for the contractor\'s system of records. O. Penalties All employees must be aware of their responsibilities under the Privacy Act and guard against improper disclosure of personal information. Any officer or employee who willfully discloses individually identifiable information, the disclosure of which is prohibited by the Act, shall be guilty of a misdemeanor and fined not more than $5,000. P. Providers, Physicians, Suppliers, and the Privacy Act: 1. Confidentiality of Provider and Supplier Records Medicare information may not be accepted from providers, physicians, and other suppliers of services on a confidential basis, expressed or implied, since any medical information obtained by a contractor is subject to disclosure to the individual to whom it pertains. Contractors are to make sure their providers and other suppliers of services are aware that no medical information marked ""confidential"" will be accepted on that basis and that any medical information', ""Without Consent, information may not be disclosed without the written consent of the subject individual, or their legal guardian, or, in the case of a minor, their parent (a parent or legal guardian of a minor may not consent to the disclosure of medical information about the minor). Other persons, regardless of relationship (except members of Congress and representative payees), may not receive information about the individual without their consent. In addition, a person who receives information about an individual with the individual's consent may not authorize disclosure of that information to someone else. Awkward situations may develop from a refusal, in compliance with the Privacy Act, to divulge information to the child or spouse of an aged or infirm individual. In order to avoid lengthy and unproductive correspondence, the requester should be advised that the Privacy Act precludes our disclosing any information to anyone other than the individual to whom the information pertains without the specific written consent of that individual, but that the requested information will be sent directly to the individual concerned with an explanation of the inquiry received on their behalf. J. Disclosures to Members of Congress Information requested by members of Congress and their staffs may be disclosed as follows: • Where a member of Congress (or a staff member) inquires on behalf of a constituent, the contractor may respond to the member of Congress (MC) without the written"", ""the Privacy Act (5U.S.C. §552a) precludes release of those records except pursuant to a written authorization to release signed by the subject(s) of the records or unless the Freedom of Information Act requires release of the records or a court of competent jurisdiction orders release. Regarding the latter condition of disclosure, for purposes of the Privacy Act, a court of competent jurisdiction is a Federal court only. Review of this matter indicates that your firm has not presented a written authorization to release records signed by the subject(s) of the records. Moreover, your firm's subpoena is not an order of a court of competent jurisdiction, and 45"", 'furnish all the information required on a claims form. When information is collected by telephone, the contractor will give the individual a brief oral explanation. When information is requested by mail a written notice is used. E. Method of Accessing Individual Records - General The law requires that an agency must inform an individual, upon request, whether a system of records contains a record pertaining to the individual, permit the individual to review such record and to be accompanied for the purpose of reviewing the record by a person of his or her choice. Further, the individual is permitted to obtain a copy of such record in a comprehensible form at a reasonable cost. There is a charge of 10 cents per page with all fees under $25 waived. There is no charge for searching; nor is there a charge for a copy furnished as a means of permitting an individual access to their records. Each requester shall be asked for proof of identity as well as such general information as is necessary to determine where and how to look for records about the data subject Within 10 working days of receiving a request, the contractor must decide whether to release the records. The requested information must be furnished within 30 working days unless good cause exists. An example of ""good cause"" would be an inactive record filed in a records center that cannot be obtained within 30 days. The requester should be told of the delay and given an approximate date to expect the information. If an', 'survivors under Exemption 6. Under the HIPAA Privacy Rule, the personal health information of deceased as well as living persons is protected. 3. Requests for Access to Records The FOIA and Privacy Act requests will continue to be handled according to current procedures and timeliness standards. A FOIA request for access to public records requires CMS, as a Federal agency, to provide the fullest possible disclosure of its records to the public, subject to certain exceptions (e.g., proprietary information, national defense risks). The Privacy Act requires CMS to provide individuals access to their personal information maintained in a System of Records. Note that an individual’s request under the Privacy Act to access his or her records must specify a', 'interim response, to the systems manager listed in the Annual Publication: Systems of Records. F. Methods of Accessing Individual Medical Records The official responsible for the records, or their designated medical officer, may disclose medical information directly to the individual if the official determines, based on review of the medical evidence, that such disclosure is not likely to have an adverse effect. In such cases the responsible official will give the requested information to the individual and annotate the record to show that the disclosure was made. If the responsible official determines that direct disclosure of the medical record would be likely to have an adverse effect on the individual or does not consider themselves qualified to make such a determination, the official will disclose the medical information to the representative designated in writing by the individual. The representative must be a medical professional (licensed medical practitioner or nurse) who would be willing to review the record and discuss it with the individual. The contractor will retain a record showing the reason for its determination and a copy of the correspondence transmitting the information to the individual or to his/her medical representative. If there is sensitive medical information in the records and the individual refuses to name a medical professional or cannot afford the fee for the service, or if the designated medical professional refuses to serve, the contractor', 'compatible with the purpose for which the information was collected in the first place. An explanation of the purposes and uses of each ""routine use"" disclosure must be published in the Federal Register at least 30 days prior to the disclosure and at least annually thereafter. Current routine uses are: • Part B Payment Records • Payment Record Reference File • Tape containing amount, type, and cost of health care services. • Summary Records • Group Health Plan Membership Data • Identification Data • Group Health Membership Data • Group Health Membership List • Quality Assurance Program Releases and Corrections M. Accounting for Disclosure The Privacy Act requires that agencies account for disclosures of personal data to organizations outside DHHS or made in response to requests under the FOIA. The purposes of the accounting are: • To allow individuals to learn to whom records about themselves have been disclosed; and • To provide a basis for subsequently advising recipients of any amended or disputed records. The accounting must enable the contractor to tell the individual when and what information about the individual was released and to whom. It is not necessary to maintain a separate record of disclosures if such information can be retrieved from the contractor\'s operating records. An individual has the same access rights to an accounting of disclosures as to other information, with no exception. It is not mandatory to tell an individual about disclosures made to an agency']","Under the Privacy Act, an ""Individual"" is defined as a living person on whom CMS has any personal (as opposed to business) information. It does not include entities such as sole proprietorships, partnerships, or corporations. Additionally, except for medical information about minors, a parent or legal guardian of a minor, or a legal guardian of someone declared incompetent by a court, has the same rights as the individual to the individual's records. No one may act on behalf of an individual who has not been declared incompetent by a court or gain access to their records without the individual's written consent.",1.0
What rights does an individual have under the Privacy Act?,"['10 - The Privacy Act of 1974 (Rev. 1, 09-11-02) A. General The purpose of the Privacy Act of 1974 is to provide safeguards for individuals against an invasion of privacy by Federal agencies. Among other things, Federal agencies are required to permit an individual to: • Determine what records pertaining to the individual are collected, used, or disseminated by such agencies; • Prevent records pertaining to the individual obtained by Federal agencies for a specific purpose from being used for another purpose without the individual\'s consent; and • Gain access to information pertaining to the individual in Federal agency records, and to correct such records when appropriate. Contractors considered to be Federal agencies for purposes of administering the Privacy Act must comply with its provisions. Contractors must: • Inform each individual from whom information is requested of their rights under the Privacy Act; • Describe the method of accessing an individual\'s records; • Prepare a method of accounting for disclosures; and • Devise a method of reviewing records at the request of individuals and making corrections if appropriate. Additional information concerning Medicare privacy policies can be accessed on the CMS Web site under the Privacy Policy link at the bottom of the web page. B. Definition of ""Individual"" ""Individual"" means a living person on whom CMS has any personal (as opposed to business) information. ""Individual"" does not include so-called persons such as sole', ""C. Physicians' and Suppliers' Rights to Access Under the Privacy Act Providers, physicians, and suppliers as business entities do not have access to business information about themselves under the Privacy Act, since the Privacy Act concerns individuals only. However, a physician or other supplier who is also an individual has the same access rights as any other individual to personal information maintained about themselves. Purely business information which is retrievable by the physician's unique identifier is not subject to the Privacy Act, but it may be disclosed to the physician to the extent that we would not deny the physician the information under the Freedom of Information Act (FOIA). D. Informing Individuals of Rights The contractor must inform the individual of his/her rights under the Privacy Act when it solicits any information directly from the beneficiary in connection with a Medicare claim. This would usually be a result of the failure of the individual or provider to furnish all the information required on a claims form. When information is collected by telephone, the contractor will give the individual a brief oral explanation. When information is requested by mail a written notice is used. E. Method of Accessing Individual Records - General The law requires that an agency must inform an individual, upon request, whether a system of records contains a record pertaining to the individual, permit the individual to review such record and to be accompanied for"", 'information that it may make, and individual privacy rights and how to exercise them. The individual rights include the right to inspect and copy protected health information, to amend protected health information, to request restrictions, confidential communications, an accounting of disclosures, a paper copy of the privacy notice, and how to file complaints. Medicare’s privacy notice was provided to beneficiaries for the first time in the 2003 Medicare & You handbook and is provided in the handbook every year. New enrollees receive the privacy notice in the handbook that is mailed to them within 30 days of Medicare entitlement. Medicare’s privacy notice is also posted on Medicare’s Web site at www.medicare.gov. Medicare’s Notice of Privacy Practices informs beneficiaries who are interested in exercising individual rights to go to www.medicare.gov or call 1-800-MEDICARE. Customer Service Representatives (CSR) at 1-800-MEDICARE use scripts to answer questions regarding exercising individual rights and filing complaints. Since Medicare’s privacy notice describes the uses and disclosures of PHI in the day-to- day operations of Medicare (including Medicare FFS contractors), FFS contractors are not required to develop a separate privacy notice for Medicare beneficiaries. G. Individual Rights and Complaints NOTE: For Individual Rights Under the Privacy Act of 1974, see §10 above. The HIPAA Privacy Rule gives individuals rights with respect to their PHI. These rights are listed in', ""the Privacy Act (5U.S.C. §552a) precludes release of those records except pursuant to a written authorization to release signed by the subject(s) of the records or unless the Freedom of Information Act requires release of the records or a court of competent jurisdiction orders release. Regarding the latter condition of disclosure, for purposes of the Privacy Act, a court of competent jurisdiction is a Federal court only. Review of this matter indicates that your firm has not presented a written authorization to release records signed by the subject(s) of the records. Moreover, your firm's subpoena is not an order of a court of competent jurisdiction, and 45"", 'individual\'s request to amend a record, the contractor should, whenever practicable, complete the review and advise the individual of the results within 10 days of the receipt of the request. Prompt action should be taken wherever possible to reduce the administrative costs involved in issuing both a separate acknowledgment of the receipt of the request and a subsequent notice informing the individual of the action taken. If a contractor denies a request for correction, the individual can appeal to the system manager for the contractor\'s system of records. O. Penalties All employees must be aware of their responsibilities under the Privacy Act and guard against improper disclosure of personal information. Any officer or employee who willfully discloses individually identifiable information, the disclosure of which is prohibited by the Act, shall be guilty of a misdemeanor and fined not more than $5,000. P. Providers, Physicians, Suppliers, and the Privacy Act: 1. Confidentiality of Provider and Supplier Records Medicare information may not be accepted from providers, physicians, and other suppliers of services on a confidential basis, expressed or implied, since any medical information obtained by a contractor is subject to disclosure to the individual to whom it pertains. Contractors are to make sure their providers and other suppliers of services are aware that no medical information marked ""confidential"" will be accepted on that basis and that any medical information', 'rights and filing complaints. Since Medicare’s privacy notice describes the uses and disclosures of PHI in the day-to- day operations of Medicare (including Medicare FFS contractors), FFS contractors are not required to develop a separate privacy notice for Medicare beneficiaries. G. Individual Rights and Complaints NOTE: For Individual Rights Under the Privacy Act of 1974, see §10 above. The HIPAA Privacy Rule gives individuals rights with respect to their PHI. These rights are listed in covered entities’ privacy notices. The Notice of Privacy Practices for the Original Medicare Plan includes the right to: 1. See and get a copy of personal health information held by Medicare. CMS Central Office is responsible for responding to beneficiary requests for access to records under the HIPAA Privacy Rule. Medicare FFS contractors should only respond to those requests for information related to payment of a claim, for which they are already responsible under the contract under existing customer service procedures. Simple telephone inquiries, such as asking about the status of a claim or requesting a duplicate Medicare Summary Notice, are not considered a HIPAA request for access and should be handled under existing customer service procedures. 2. Have personal health information amended if it is wrong or missing, and Medicare agrees. If Medicare disagrees, a statement of disagreement may be added to the personal health information.', 'furnish all the information required on a claims form. When information is collected by telephone, the contractor will give the individual a brief oral explanation. When information is requested by mail a written notice is used. E. Method of Accessing Individual Records - General The law requires that an agency must inform an individual, upon request, whether a system of records contains a record pertaining to the individual, permit the individual to review such record and to be accompanied for the purpose of reviewing the record by a person of his or her choice. Further, the individual is permitted to obtain a copy of such record in a comprehensible form at a reasonable cost. There is a charge of 10 cents per page with all fees under $25 waived. There is no charge for searching; nor is there a charge for a copy furnished as a means of permitting an individual access to their records. Each requester shall be asked for proof of identity as well as such general information as is necessary to determine where and how to look for records about the data subject Within 10 working days of receiving a request, the contractor must decide whether to release the records. The requested information must be furnished within 30 working days unless good cause exists. An example of ""good cause"" would be an inactive record filed in a records center that cannot be obtained within 30 days. The requester should be told of the delay and given an approximate date to expect the information. If an', 'survivors under Exemption 6. Under the HIPAA Privacy Rule, the personal health information of deceased as well as living persons is protected. 3. Requests for Access to Records The FOIA and Privacy Act requests will continue to be handled according to current procedures and timeliness standards. A FOIA request for access to public records requires CMS, as a Federal agency, to provide the fullest possible disclosure of its records to the public, subject to certain exceptions (e.g., proprietary information, national defense risks). The Privacy Act requires CMS to provide individuals access to their personal information maintained in a System of Records. Note that an individual’s request under the Privacy Act to access his or her records must specify a', 'method of accounting for disclosures; and • Devise a method of reviewing records at the request of individuals and making corrections if appropriate. Additional information concerning Medicare privacy policies can be accessed on the CMS Web site under the Privacy Policy link at the bottom of the web page. B. Definition of ""Individual"" ""Individual"" means a living person on whom CMS has any personal (as opposed to business) information. ""Individual"" does not include so-called persons such as sole proprietorships, partnerships, or corporations. Except for disclosure of and access to medical information about minors, a parent or legal guardian of a minor, or a legal guardian of someone the court has declared incompetent, has the same rights as the individual to the individual\'s records. No one may act on behalf of an individual who has not been declared incompetent by a court or gain access to his/her records under the Privacy Act without the individual\'s written consent.', 'to determine where and how to look for records about the data subject Within 10 working days of receiving a request, the contractor must decide whether to release the records. The requested information must be furnished within 30 working days unless good cause exists. An example of ""good cause"" would be an inactive record filed in a records center that cannot be obtained within 30 days. The requester should be told of the delay and given an approximate date to expect the information. If an individual\'s request for information concerning themselves is not in the contractor\'s files, the contractor should advise the individual that it does not have the information and, if available elsewhere, that it is forwarding the request to the office which has it. The contractor should furnish any requested information available if the request cannot be satisfied in full. The contractor should identify requests under the Privacy Act that require referral to CMS for data in central office systems. As required by the Privacy Act, the contractor should send the request for processing, along with a copy of the']","Under the Privacy Act of 1974, an individual has the following rights:

- To determine what records pertaining to themselves are collected, used, or disseminated by Federal agencies.
- To prevent records obtained by Federal agencies for a specific purpose from being used for another purpose without their consent.
- To gain access to information pertaining to themselves in Federal agency records.
- To correct such records when appropriate.
- To be informed of their rights under the Privacy Act when information is requested from them.
- To access their records, including the right to review the records and be accompanied by a person of their choice during the review.
- To obtain a copy of their records in a comprehensible form at a reasonable cost (10 cents per page, with fees under $25 waived).
- To request amendments to their records if they believe the information is wrong or missing.
- To appeal to the system manager if a request for correction is denied.
- To receive an accounting of disclosures of their records.
- To be informed about how to exercise their privacy rights and how to file complaints.

Additionally, contractors must inform individuals of these rights when soliciting information and provide methods for accessing and correcting records.",1.0
Can a physician access personal information about themselves under the Privacy Act?,"[""C. Physicians' and Suppliers' Rights to Access Under the Privacy Act Providers, physicians, and suppliers as business entities do not have access to business information about themselves under the Privacy Act, since the Privacy Act concerns individuals only. However, a physician or other supplier who is also an individual has the same access rights as any other individual to personal information maintained about themselves. Purely business information which is retrievable by the physician's unique identifier is not subject to the Privacy Act, but it may be disclosed to the physician to the extent that we would not deny the physician the information under the Freedom of Information Act (FOIA). D. Informing Individuals of Rights The contractor must inform the individual of his/her rights under the Privacy Act when it solicits any information directly from the beneficiary in connection with a Medicare claim. This would usually be a result of the failure of the individual or provider to furnish all the information required on a claims form. When information is collected by telephone, the contractor will give the individual a brief oral explanation. When information is requested by mail a written notice is used. E. Method of Accessing Individual Records - General The law requires that an agency must inform an individual, upon request, whether a system of records contains a record pertaining to the individual, permit the individual to review such record and to be accompanied for"", 'survivors under Exemption 6. Under the HIPAA Privacy Rule, the personal health information of deceased as well as living persons is protected. 3. Requests for Access to Records The FOIA and Privacy Act requests will continue to be handled according to current procedures and timeliness standards. A FOIA request for access to public records requires CMS, as a Federal agency, to provide the fullest possible disclosure of its records to the public, subject to certain exceptions (e.g., proprietary information, national defense risks). The Privacy Act requires CMS to provide individuals access to their personal information maintained in a System of Records. Note that an individual’s request under the Privacy Act to access his or her records must specify a', '10 - The Privacy Act of 1974 (Rev. 1, 09-11-02) A. General The purpose of the Privacy Act of 1974 is to provide safeguards for individuals against an invasion of privacy by Federal agencies. Among other things, Federal agencies are required to permit an individual to: • Determine what records pertaining to the individual are collected, used, or disseminated by such agencies; • Prevent records pertaining to the individual obtained by Federal agencies for a specific purpose from being used for another purpose without the individual\'s consent; and • Gain access to information pertaining to the individual in Federal agency records, and to correct such records when appropriate. Contractors considered to be Federal agencies for purposes of administering the Privacy Act must comply with its provisions. Contractors must: • Inform each individual from whom information is requested of their rights under the Privacy Act; • Describe the method of accessing an individual\'s records; • Prepare a method of accounting for disclosures; and • Devise a method of reviewing records at the request of individuals and making corrections if appropriate. Additional information concerning Medicare privacy policies can be accessed on the CMS Web site under the Privacy Policy link at the bottom of the web page. B. Definition of ""Individual"" ""Individual"" means a living person on whom CMS has any personal (as opposed to business) information. ""Individual"" does not include so-called persons such as sole', 'interim response, to the systems manager listed in the Annual Publication: Systems of Records. F. Methods of Accessing Individual Medical Records The official responsible for the records, or their designated medical officer, may disclose medical information directly to the individual if the official determines, based on review of the medical evidence, that such disclosure is not likely to have an adverse effect. In such cases the responsible official will give the requested information to the individual and annotate the record to show that the disclosure was made. If the responsible official determines that direct disclosure of the medical record would be likely to have an adverse effect on the individual or does not consider themselves qualified to make such a determination, the official will disclose the medical information to the representative designated in writing by the individual. The representative must be a medical professional (licensed medical practitioner or nurse) who would be willing to review the record and discuss it with the individual. The contractor will retain a record showing the reason for its determination and a copy of the correspondence transmitting the information to the individual or to his/her medical representative. If there is sensitive medical information in the records and the individual refuses to name a medical professional or cannot afford the fee for the service, or if the designated medical professional refuses to serve, the contractor', 'individual\'s request to amend a record, the contractor should, whenever practicable, complete the review and advise the individual of the results within 10 days of the receipt of the request. Prompt action should be taken wherever possible to reduce the administrative costs involved in issuing both a separate acknowledgment of the receipt of the request and a subsequent notice informing the individual of the action taken. If a contractor denies a request for correction, the individual can appeal to the system manager for the contractor\'s system of records. O. Penalties All employees must be aware of their responsibilities under the Privacy Act and guard against improper disclosure of personal information. Any officer or employee who willfully discloses individually identifiable information, the disclosure of which is prohibited by the Act, shall be guilty of a misdemeanor and fined not more than $5,000. P. Providers, Physicians, Suppliers, and the Privacy Act: 1. Confidentiality of Provider and Supplier Records Medicare information may not be accepted from providers, physicians, and other suppliers of services on a confidential basis, expressed or implied, since any medical information obtained by a contractor is subject to disclosure to the individual to whom it pertains. Contractors are to make sure their providers and other suppliers of services are aware that no medical information marked ""confidential"" will be accepted on that basis and that any medical information', 'be permitted for Medicare. Similarly, if the disclosure is a “routine use” under the Privacy Act, but the HIPAA Privacy Rule prohibits the disclosure, CMS will not make the disclosure. Exemption 6 of the Freedom of Information Act (FOIA) permits Federal agencies to withhold personnel and medical files the disclosure of which would constitute a clearly unwarranted invasion of personal privacy. When a FOIA request asks for documents that include personal information, CMS must apply Exemption 6 to preclude the release of, or must otherwise redact, identifying details before disclosing the remaining information. 2. Information About Deceased Individuals The application of Exemption 6 of the FOIA to information about deceased individuals requires a different analysis than that applicable to living individuals because under the Privacy Act of 1974, privacy rights are extinguished at death. However, under FOIA, it is entirely appropriate to consider the privacy interest of a decedent’s survivors under Exemption 6. Under the HIPAA Privacy Rule, the personal health information of deceased as well as living persons is protected. 3. Requests for Access to Records The FOIA and Privacy Act requests will continue to be handled according to current procedures and timeliness standards. A FOIA request for access to public records requires CMS, as a Federal agency, to provide the fullest possible disclosure of its records to the public, subject to certain exceptions (e.g., proprietary', ""Without Consent, information may not be disclosed without the written consent of the subject individual, or their legal guardian, or, in the case of a minor, their parent (a parent or legal guardian of a minor may not consent to the disclosure of medical information about the minor). Other persons, regardless of relationship (except members of Congress and representative payees), may not receive information about the individual without their consent. In addition, a person who receives information about an individual with the individual's consent may not authorize disclosure of that information to someone else. Awkward situations may develop from a refusal, in compliance with the Privacy Act, to divulge information to the child or spouse of an aged or infirm individual. In order to avoid lengthy and unproductive correspondence, the requester should be advised that the Privacy Act precludes our disclosing any information to anyone other than the individual to whom the information pertains without the specific written consent of that individual, but that the requested information will be sent directly to the individual concerned with an explanation of the inquiry received on their behalf. J. Disclosures to Members of Congress Information requested by members of Congress and their staffs may be disclosed as follows: • Where a member of Congress (or a staff member) inquires on behalf of a constituent, the contractor may respond to the member of Congress (MC) without the written"", ""In each case where a minor's medical records are sent to a physician or health professional, reasonable efforts will be made by the contractor to so inform the minor. In the event the parent or guardian refuses to name a medical professional or cannot afford the fee for the service or the designated medical professional refuses to serve, the contractor will refer the file to the CMS regional office for appropriate action. H. Disclosure to Third Parties The Privacy Act permits disclosure to any third party with the written consent of the individual to whom the record pertains. It also permits disclosure in certain instances without the individual's consent. However, the contractor must not disclose information unless the disclosure is specifically authorized in this chapter, or the individual has consented to the disclosure in writing, or the CMS regional office authorizes the disclosure. I. Disclosures with Consent Except for those disclosures discussed below in §10L of this chapter, Disclosure Without Consent, information may not be disclosed without the written consent of the subject individual, or their legal guardian, or, in the case of a minor, their parent (a parent or legal guardian of a minor may not consent to the disclosure of medical information about the minor). Other persons, regardless of relationship (except members of Congress and representative payees), may not receive information about the individual without their consent. In addition, a person who receives"", ""be willing to review the record and discuss it with the individual. The contractor will retain a record showing the reason for its determination and a copy of the correspondence transmitting the information to the individual or to his/her medical representative. If there is sensitive medical information in the records and the individual refuses to name a medical professional or cannot afford the fee for the service, or if the designated medical professional refuses to serve, the contractor will refer the file to the CMS regional office. G. Disclosure of Medical Information Relating to Minors In order to protect the privacy of a minor, a parent or authorized guardian who requests access to the minor's medical record may not be given direct access to the record. Contractors shall ask a parent or guardian who requests access to such a record to designate a physician or other professional (other than a family member) to whom the record may be sent. The physician or health professional to whom the record is sent will be asked by the contractor to consider the effect that the disclosure of the record to the parent or guardian would have on the minor in determining whether the record should be made available to the parent or guardian. The contractor will prepare a response to the parent or guardian in substantially the following form: We have completed processing your request for access to the medical records of (name)__________________________, a minor The medical records have"", 'or physician are not subject to the prohibition against disclosure or to the Departmental rules and regulations concerning confidentiality merely because the patient is entitled to Medicare benefits. Disclosure of provider or physician records not in the possession of CMS or a contractor may, however, be subject to applicable State or local laws, or to hospital rules governing disclosure. B. Authority for Refusal to Disclose Information Denial of all or portions of requested records can only be made by the CMS Freedom of Information Officer. Therefore, when a request for information is received, disclosure of which is prohibited under these guidelines, the contractor will follow §10.2 above. The CMS FOIA Officer has authorized Medicare contractors to issue a denial on his/her behalf in the following situation: If any officer, employee, agent or subcontractor is served a subpoena or other compulsory process requiring the production of records or information on a beneficiary or individual practitioner that are contained in a Privacy Act System of records and such a request is not accompanied by a valid authorization to release the records signed by the subject of the records, he/she will decline to produce the records or information. He/she will base the refusal on §1106 of the Social Security Act and on 5 USC §552a, 5 USC §552, 45 CFR Part 2 and 45 CFR Part 5. The contractor will notify the RO immediately. If the contractor directly receives such a subpoena, it uses the']","Yes, a physician who is also an individual has the same access rights as any other individual to personal information maintained about themselves under the Privacy Act. However, purely business information about the physician, which is retrievable by the physician's unique identifier, is not subject to the Privacy Act, though it may be disclosed to the physician to the extent allowed under the Freedom of Information Act (FOIA).",0.75
When must contractors inform individuals of their Privacy Act rights?,"['furnish all the information required on a claims form. When information is collected by telephone, the contractor will give the individual a brief oral explanation. When information is requested by mail a written notice is used. E. Method of Accessing Individual Records - General The law requires that an agency must inform an individual, upon request, whether a system of records contains a record pertaining to the individual, permit the individual to review such record and to be accompanied for the purpose of reviewing the record by a person of his or her choice. Further, the individual is permitted to obtain a copy of such record in a comprehensible form at a reasonable cost. There is a charge of 10 cents per page with all fees under $25 waived. There is no charge for searching; nor is there a charge for a copy furnished as a means of permitting an individual access to their records. Each requester shall be asked for proof of identity as well as such general information as is necessary to determine where and how to look for records about the data subject Within 10 working days of receiving a request, the contractor must decide whether to release the records. The requested information must be furnished within 30 working days unless good cause exists. An example of ""good cause"" would be an inactive record filed in a records center that cannot be obtained within 30 days. The requester should be told of the delay and given an approximate date to expect the information. If an', '10 - The Privacy Act of 1974 (Rev. 1, 09-11-02) A. General The purpose of the Privacy Act of 1974 is to provide safeguards for individuals against an invasion of privacy by Federal agencies. Among other things, Federal agencies are required to permit an individual to: • Determine what records pertaining to the individual are collected, used, or disseminated by such agencies; • Prevent records pertaining to the individual obtained by Federal agencies for a specific purpose from being used for another purpose without the individual\'s consent; and • Gain access to information pertaining to the individual in Federal agency records, and to correct such records when appropriate. Contractors considered to be Federal agencies for purposes of administering the Privacy Act must comply with its provisions. Contractors must: • Inform each individual from whom information is requested of their rights under the Privacy Act; • Describe the method of accessing an individual\'s records; • Prepare a method of accounting for disclosures; and • Devise a method of reviewing records at the request of individuals and making corrections if appropriate. Additional information concerning Medicare privacy policies can be accessed on the CMS Web site under the Privacy Policy link at the bottom of the web page. B. Definition of ""Individual"" ""Individual"" means a living person on whom CMS has any personal (as opposed to business) information. ""Individual"" does not include so-called persons such as sole', 'individual\'s request to amend a record, the contractor should, whenever practicable, complete the review and advise the individual of the results within 10 days of the receipt of the request. Prompt action should be taken wherever possible to reduce the administrative costs involved in issuing both a separate acknowledgment of the receipt of the request and a subsequent notice informing the individual of the action taken. If a contractor denies a request for correction, the individual can appeal to the system manager for the contractor\'s system of records. O. Penalties All employees must be aware of their responsibilities under the Privacy Act and guard against improper disclosure of personal information. Any officer or employee who willfully discloses individually identifiable information, the disclosure of which is prohibited by the Act, shall be guilty of a misdemeanor and fined not more than $5,000. P. Providers, Physicians, Suppliers, and the Privacy Act: 1. Confidentiality of Provider and Supplier Records Medicare information may not be accepted from providers, physicians, and other suppliers of services on a confidential basis, expressed or implied, since any medical information obtained by a contractor is subject to disclosure to the individual to whom it pertains. Contractors are to make sure their providers and other suppliers of services are aware that no medical information marked ""confidential"" will be accepted on that basis and that any medical information', 'to determine where and how to look for records about the data subject Within 10 working days of receiving a request, the contractor must decide whether to release the records. The requested information must be furnished within 30 working days unless good cause exists. An example of ""good cause"" would be an inactive record filed in a records center that cannot be obtained within 30 days. The requester should be told of the delay and given an approximate date to expect the information. If an individual\'s request for information concerning themselves is not in the contractor\'s files, the contractor should advise the individual that it does not have the information and, if available elsewhere, that it is forwarding the request to the office which has it. The contractor should furnish any requested information available if the request cannot be satisfied in full. The contractor should identify requests under the Privacy Act that require referral to CMS for data in central office systems. As required by the Privacy Act, the contractor should send the request for processing, along with a copy of the', ""C. Physicians' and Suppliers' Rights to Access Under the Privacy Act Providers, physicians, and suppliers as business entities do not have access to business information about themselves under the Privacy Act, since the Privacy Act concerns individuals only. However, a physician or other supplier who is also an individual has the same access rights as any other individual to personal information maintained about themselves. Purely business information which is retrievable by the physician's unique identifier is not subject to the Privacy Act, but it may be disclosed to the physician to the extent that we would not deny the physician the information under the Freedom of Information Act (FOIA). D. Informing Individuals of Rights The contractor must inform the individual of his/her rights under the Privacy Act when it solicits any information directly from the beneficiary in connection with a Medicare claim. This would usually be a result of the failure of the individual or provider to furnish all the information required on a claims form. When information is collected by telephone, the contractor will give the individual a brief oral explanation. When information is requested by mail a written notice is used. E. Method of Accessing Individual Records - General The law requires that an agency must inform an individual, upon request, whether a system of records contains a record pertaining to the individual, permit the individual to review such record and to be accompanied for"", 'information that it may make, and individual privacy rights and how to exercise them. The individual rights include the right to inspect and copy protected health information, to amend protected health information, to request restrictions, confidential communications, an accounting of disclosures, a paper copy of the privacy notice, and how to file complaints. Medicare’s privacy notice was provided to beneficiaries for the first time in the 2003 Medicare & You handbook and is provided in the handbook every year. New enrollees receive the privacy notice in the handbook that is mailed to them within 30 days of Medicare entitlement. Medicare’s privacy notice is also posted on Medicare’s Web site at www.medicare.gov. Medicare’s Notice of Privacy Practices informs beneficiaries who are interested in exercising individual rights to go to www.medicare.gov or call 1-800-MEDICARE. Customer Service Representatives (CSR) at 1-800-MEDICARE use scripts to answer questions regarding exercising individual rights and filing complaints. Since Medicare’s privacy notice describes the uses and disclosures of PHI in the day-to- day operations of Medicare (including Medicare FFS contractors), FFS contractors are not required to develop a separate privacy notice for Medicare beneficiaries. G. Individual Rights and Complaints NOTE: For Individual Rights Under the Privacy Act of 1974, see §10 above. The HIPAA Privacy Rule gives individuals rights with respect to their PHI. These rights are listed in', 'However, when the contractor enters into an agreement with these parties, it will inform them that §401.1 of Regulation No. 1 precludes the disclosure of any information on identifiable individuals. It will call their attention to the penalty clause of §1106(a). It will call attention to these provisions by letter (see below), and obtain a written agreement to comply with the disclosure provisions before releasing any information. Sample Letter to Third Party Dear We are prepared to make available to your organization certain social security records so that (state reason). However, before making these records available, we must point out that by law, all information derived on identifiable individuals in the administration of the Social Security Act is confidential and may be disclosed to others only under very restrictive circumstances. Regulation No. 1 of the Social Security Administration which governs disclosure of official records and information precludes you from disclosing any information on identifiable individuals. You should also note that §1106(a) of the Social Security Act imposes criminal penalties for unauthorized disclosure. Any social security records which do not identify or make identifiable any individuals are not subject to these restrictions, but may be restricted under the provisions of the Freedom of Information Act. In order to comply with the requirements of the Social Security Act and Freedom of Information Act you must agree to the following', 'Generally, the contractor will not honor requests for information about a specific physician or other supplier of services, or for information which would identify such a physician or other supplier of services, except in situations described in §140.1 above. Disclosure to third parties for program purposes of information about individual physicians and other suppliers who are natural persons is governed by the same restrictions and procedures as disclosure about named beneficiaries to third parties for program purposes. (See §50B of this chapter.) The contractor acknowledges such requests and refers them to the RO for response. If the information the contractor discloses is solely information that does not identify or make identifiable individuals (e.g., aggregate statistics or records on providers and other corporate entities), it uses the following language: Dear: We are prepared to make available to your organization certain social security records so that (state reason). However, before making these records available to you, we must point out that by law all information derived in the administration of the Social Security Act is subject to the provisions of the Freedom of Information Act, which exempts from disclosure certain categories of records. In order to assure that no records held confidential under the Freedom of Information Act are disclosed, you must agree to meet the following conditions before we make any social security records available to you: 1. Any', 'procedures (see §10J above). K. Administrative Requirements As Medicare’s business associate, contractors are not subject to the administrative requirements of the HIPAA Privacy Rule. However, under the Privacy Act, contractors must comply with the privacy provisions specified in their contracts. Contractors are not required to designate a privacy official. However, contractors are required to have in place a senior official or other responsible party to address the privacy concerns of the organization and to establish an internal control system to monitor compliance with privacy requirements. Similarly, as Medicare’s business associate, contractors are not subject to the HIPAA Privacy Rule’s requirement to train staff specifically on the HIPAA Privacy Rule.', ""In each case where a minor's medical records are sent to a physician or health professional, reasonable efforts will be made by the contractor to so inform the minor. In the event the parent or guardian refuses to name a medical professional or cannot afford the fee for the service or the designated medical professional refuses to serve, the contractor will refer the file to the CMS regional office for appropriate action. H. Disclosure to Third Parties The Privacy Act permits disclosure to any third party with the written consent of the individual to whom the record pertains. It also permits disclosure in certain instances without the individual's consent. However, the contractor must not disclose information unless the disclosure is specifically authorized in this chapter, or the individual has consented to the disclosure in writing, or the CMS regional office authorizes the disclosure. I. Disclosures with Consent Except for those disclosures discussed below in §10L of this chapter, Disclosure Without Consent, information may not be disclosed without the written consent of the subject individual, or their legal guardian, or, in the case of a minor, their parent (a parent or legal guardian of a minor may not consent to the disclosure of medical information about the minor). Other persons, regardless of relationship (except members of Congress and representative payees), may not receive information about the individual without their consent. In addition, a person who receives""]","Contractors must inform individuals of their rights under the Privacy Act when they solicit any information directly from the beneficiary in connection with a Medicare claim. This typically occurs as a result of the failure of the individual or provider to furnish all the information required on a claims form. When information is collected by telephone, the contractor provides a brief oral explanation, and when information is requested by mail, a written notice is used.",1.0
How much is charged per page for copies of records under the Privacy Act?,"['charge the requester if the charge to be billed is less than the established billing threshold. NOTE: The CMS Freedom of Information Officer can rule on requests for waiver or reduction of fees, other than those listed above. 2. Regardless of the actual cost of responding to the requester, the law only permits charges to be levied for certain services and only in accord with a published FOIA fee schedule. The DHHS schedule at 45 CFR Part 5 is binding on CMS, and results in the following charges: a. Photocopying - Charge 10 cents per page for copying records. The contractor may charge lower fees for particular documents where: • The document has already been printed in large numbers, • The contractor determines that using existing stock to answer this request, and any other anticipated FOI requests will not interfere with program requirements, and • The contractor determines that the lower fee is adequate to recover the prorated share of the original printing costs. b. Search and Review - For manual searching and for review (when used, as applicable, in connection with processing records for a commercial use or other request), base the cost on the hourly rate of employees involved. Equate employee hourly wage scales to these three categories: Level Hourly Wage Range GS Grade Range CMS Bills Level 1 Up to $20.74 Federal Grades 1 through 8 $16.00 Level 2 $20.75 - $46.69 Federal Grades 9 through 14 $33.00 Level 3 $46.70 or more/hr Federal Grades 15 and up $59.00 NOTE: The CMS', ""Certifying that records are true copies - Charge $10 per certification. Performing any other special service requested, that the contractor agrees to provide - actual costs of operating any machinery, plus actual cost of any materials used, plus charges for the time of its employees, at the rates given in paragraph 2b of this section. Special Forwarding Arrangements - Actual cost. This includes special delivery, airmail, registered mail, etc. 21.2 - Billing of Fees and Charges (Rev. 1, 09-11-02) The contractor is responsible for the billing of costs resulting from providing disclosable information. To invoice, use Form CMS-633 - Invoice of Fees for FOIA Services (Exhibit C). The requester sends payment derived from the release of information to the CMS Division of Accounting. 21.3 - Advance Payment/Requests Fulfilled Without Remittance (Rev. 1, 09-11-02) Where estimated costs exceed $250.00, or if the requester has failed to pay previous bills in a timely fashion, collect fees and charges before the requested material is copied and furnished. Use the Division of Accounting, CMS's FOIA Bad Debtor Listing to determine delinquency. Notify the requester of the total estimated charges, using language similar to the following: The HHS regulations require that a charge be made to recover some of the costs incurred in the disclosure of information. The total (estimated) billable cost for the material you requested is $ ______. The cost consists of the following charges: (list here"", 'and activities. Members of Congress, when clearly requesting information on behalf of a constituent or other third party, are subject to the same fees and charges that would apply to the person represented. The contractor will not charge the public for inspection of disclosable documents, or for requests which result in charges under the minimum described in §21.3, below. 21.1 – Fees (Rev. 1, 09-11-02) 1. Fees are to be charged differentially, depending on the category of requester/use of the requested material, as follows: • Commercial Use Request - If the request is for a commercial use, charge the requester for search and review, plus duplication. • Education and Scientific Institutions and News Media - If the requester is (1) an educational institution or a non-commercial scientific institution operated primarily for scholarly or scientific research, or (2) a representative of the news media, charge only for duplication. However, do not charge for the first 100 pages of duplication. • Other Requesters - If the request fits into neither of the above categories, charge for search and duplication. However, do not charge for the first 2 hours of search time and the first 100 pages of duplication. In addition, do not', ""- For manual searching and for review (when used, as applicable, in connection with processing records for a commercial use or other request), base the cost on the hourly rate of employees involved. Equate employee hourly wage scales to these three categories: Level Hourly Wage Range GS Grade Range CMS Bills Level 1 Up to $20.74 Federal Grades 1 through 8 $16.00 Level 2 $20.75 - $46.69 Federal Grades 9 through 14 $33.00 Level 3 $46.70 or more/hr Federal Grades 15 and up $59.00 NOTE: The CMS Freedom of Information Officer updates the above scale based upon changes to the HHS fee schedule, and provides such updates to all CMS/contractor FOIA Coordinators. The contractor will not charge the requester any fee at all if the costs of routine collection and processing of the fee are likely to equal or exceed the amount of the fee. As of November 2001, CMS's charge threshold is $15.00. If the contractor determines that the requester is breaking down a single request into a series of requests in order to avoid (or reduce) the fees charged, it may aggregate all these requests for purposes of calculating the fees charged."", 'individual\'s request to amend a record, the contractor should, whenever practicable, complete the review and advise the individual of the results within 10 days of the receipt of the request. Prompt action should be taken wherever possible to reduce the administrative costs involved in issuing both a separate acknowledgment of the receipt of the request and a subsequent notice informing the individual of the action taken. If a contractor denies a request for correction, the individual can appeal to the system manager for the contractor\'s system of records. O. Penalties All employees must be aware of their responsibilities under the Privacy Act and guard against improper disclosure of personal information. Any officer or employee who willfully discloses individually identifiable information, the disclosure of which is prohibited by the Act, shall be guilty of a misdemeanor and fined not more than $5,000. P. Providers, Physicians, Suppliers, and the Privacy Act: 1. Confidentiality of Provider and Supplier Records Medicare information may not be accepted from providers, physicians, and other suppliers of services on a confidential basis, expressed or implied, since any medical information obtained by a contractor is subject to disclosure to the individual to whom it pertains. Contractors are to make sure their providers and other suppliers of services are aware that no medical information marked ""confidential"" will be accepted on that basis and that any medical information', ""the Privacy Act (5U.S.C. §552a) precludes release of those records except pursuant to a written authorization to release signed by the subject(s) of the records or unless the Freedom of Information Act requires release of the records or a court of competent jurisdiction orders release. Regarding the latter condition of disclosure, for purposes of the Privacy Act, a court of competent jurisdiction is a Federal court only. Review of this matter indicates that your firm has not presented a written authorization to release records signed by the subject(s) of the records. Moreover, your firm's subpoena is not an order of a court of competent jurisdiction, and 45"", '10 - The Privacy Act of 1974 (Rev. 1, 09-11-02) A. General The purpose of the Privacy Act of 1974 is to provide safeguards for individuals against an invasion of privacy by Federal agencies. Among other things, Federal agencies are required to permit an individual to: • Determine what records pertaining to the individual are collected, used, or disseminated by such agencies; • Prevent records pertaining to the individual obtained by Federal agencies for a specific purpose from being used for another purpose without the individual\'s consent; and • Gain access to information pertaining to the individual in Federal agency records, and to correct such records when appropriate. Contractors considered to be Federal agencies for purposes of administering the Privacy Act must comply with its provisions. Contractors must: • Inform each individual from whom information is requested of their rights under the Privacy Act; • Describe the method of accessing an individual\'s records; • Prepare a method of accounting for disclosures; and • Devise a method of reviewing records at the request of individuals and making corrections if appropriate. Additional information concerning Medicare privacy policies can be accessed on the CMS Web site under the Privacy Policy link at the bottom of the web page. B. Definition of ""Individual"" ""Individual"" means a living person on whom CMS has any personal (as opposed to business) information. ""Individual"" does not include so-called persons such as sole', 'before the requested material is copied and furnished. Use the Division of Accounting, CMS\'s FOIA Bad Debtor Listing to determine delinquency. Notify the requester of the total estimated charges, using language similar to the following: The HHS regulations require that a charge be made to recover some of the costs incurred in the disclosure of information. The total (estimated) billable cost for the material you requested is $ ______. The cost consists of the following charges: (list here breakdown of charges; e.g., ""Photocopying: $10; Searching: $450). Please send a check or money order for the total amount made out to CMS and mail it to (contractor address). The material will be mailed to you upon receipt of payment (subject to any adjustment to the estimate). If we do not hear from you within 30 days, we will assume your request has been withdrawn and no further action will be taken. Be sure to point out to the requester that even though the invoice says to mail the check to the CMS Division of Accounting in Baltimore, in this case the check must be mailed to the contractor so that payment can be verified before the material is mailed. Subsequent to the contractor\'s receipt of the advance payment, send both the check and the finance copy of the invoice to the Division of Accounting in Baltimore. Because some requesters will neither provide advance payment nor notify the contractor that they no longer desire the requested material, do not send the ""Finance"" copy of the', 'to determine where and how to look for records about the data subject Within 10 working days of receiving a request, the contractor must decide whether to release the records. The requested information must be furnished within 30 working days unless good cause exists. An example of ""good cause"" would be an inactive record filed in a records center that cannot be obtained within 30 days. The requester should be told of the delay and given an approximate date to expect the information. If an individual\'s request for information concerning themselves is not in the contractor\'s files, the contractor should advise the individual that it does not have the information and, if available elsewhere, that it is forwarding the request to the office which has it. The contractor should furnish any requested information available if the request cannot be satisfied in full. The contractor should identify requests under the Privacy Act that require referral to CMS for data in central office systems. As required by the Privacy Act, the contractor should send the request for processing, along with a copy of the', 'furnish all the information required on a claims form. When information is collected by telephone, the contractor will give the individual a brief oral explanation. When information is requested by mail a written notice is used. E. Method of Accessing Individual Records - General The law requires that an agency must inform an individual, upon request, whether a system of records contains a record pertaining to the individual, permit the individual to review such record and to be accompanied for the purpose of reviewing the record by a person of his or her choice. Further, the individual is permitted to obtain a copy of such record in a comprehensible form at a reasonable cost. There is a charge of 10 cents per page with all fees under $25 waived. There is no charge for searching; nor is there a charge for a copy furnished as a means of permitting an individual access to their records. Each requester shall be asked for proof of identity as well as such general information as is necessary to determine where and how to look for records about the data subject Within 10 working days of receiving a request, the contractor must decide whether to release the records. The requested information must be furnished within 30 working days unless good cause exists. An example of ""good cause"" would be an inactive record filed in a records center that cannot be obtained within 30 days. The requester should be told of the delay and given an approximate date to expect the information. If an']","Under the Privacy Act, the charge for copies of records is 10 cents per page. However, all fees under $25 are waived, and there is no charge for searching or for a copy furnished as a means of permitting an individual access to their records.",1.0
Is there a charge for searching records under the Privacy Act?,"['and activities. Members of Congress, when clearly requesting information on behalf of a constituent or other third party, are subject to the same fees and charges that would apply to the person represented. The contractor will not charge the public for inspection of disclosable documents, or for requests which result in charges under the minimum described in §21.3, below. 21.1 – Fees (Rev. 1, 09-11-02) 1. Fees are to be charged differentially, depending on the category of requester/use of the requested material, as follows: • Commercial Use Request - If the request is for a commercial use, charge the requester for search and review, plus duplication. • Education and Scientific Institutions and News Media - If the requester is (1) an educational institution or a non-commercial scientific institution operated primarily for scholarly or scientific research, or (2) a representative of the news media, charge only for duplication. However, do not charge for the first 100 pages of duplication. • Other Requesters - If the request fits into neither of the above categories, charge for search and duplication. However, do not charge for the first 2 hours of search time and the first 100 pages of duplication. In addition, do not', 'charge the requester if the charge to be billed is less than the established billing threshold. NOTE: The CMS Freedom of Information Officer can rule on requests for waiver or reduction of fees, other than those listed above. 2. Regardless of the actual cost of responding to the requester, the law only permits charges to be levied for certain services and only in accord with a published FOIA fee schedule. The DHHS schedule at 45 CFR Part 5 is binding on CMS, and results in the following charges: a. Photocopying - Charge 10 cents per page for copying records. The contractor may charge lower fees for particular documents where: • The document has already been printed in large numbers, • The contractor determines that using existing stock to answer this request, and any other anticipated FOI requests will not interfere with program requirements, and • The contractor determines that the lower fee is adequate to recover the prorated share of the original printing costs. b. Search and Review - For manual searching and for review (when used, as applicable, in connection with processing records for a commercial use or other request), base the cost on the hourly rate of employees involved. Equate employee hourly wage scales to these three categories: Level Hourly Wage Range GS Grade Range CMS Bills Level 1 Up to $20.74 Federal Grades 1 through 8 $16.00 Level 2 $20.75 - $46.69 Federal Grades 9 through 14 $33.00 Level 3 $46.70 or more/hr Federal Grades 15 and up $59.00 NOTE: The CMS', ""- For manual searching and for review (when used, as applicable, in connection with processing records for a commercial use or other request), base the cost on the hourly rate of employees involved. Equate employee hourly wage scales to these three categories: Level Hourly Wage Range GS Grade Range CMS Bills Level 1 Up to $20.74 Federal Grades 1 through 8 $16.00 Level 2 $20.75 - $46.69 Federal Grades 9 through 14 $33.00 Level 3 $46.70 or more/hr Federal Grades 15 and up $59.00 NOTE: The CMS Freedom of Information Officer updates the above scale based upon changes to the HHS fee schedule, and provides such updates to all CMS/contractor FOIA Coordinators. The contractor will not charge the requester any fee at all if the costs of routine collection and processing of the fee are likely to equal or exceed the amount of the fee. As of November 2001, CMS's charge threshold is $15.00. If the contractor determines that the requester is breaking down a single request into a series of requests in order to avoid (or reduce) the fees charged, it may aggregate all these requests for purposes of calculating the fees charged."", ""the Privacy Act (5U.S.C. §552a) precludes release of those records except pursuant to a written authorization to release signed by the subject(s) of the records or unless the Freedom of Information Act requires release of the records or a court of competent jurisdiction orders release. Regarding the latter condition of disclosure, for purposes of the Privacy Act, a court of competent jurisdiction is a Federal court only. Review of this matter indicates that your firm has not presented a written authorization to release records signed by the subject(s) of the records. Moreover, your firm's subpoena is not an order of a court of competent jurisdiction, and 45"", ""Certifying that records are true copies - Charge $10 per certification. Performing any other special service requested, that the contractor agrees to provide - actual costs of operating any machinery, plus actual cost of any materials used, plus charges for the time of its employees, at the rates given in paragraph 2b of this section. Special Forwarding Arrangements - Actual cost. This includes special delivery, airmail, registered mail, etc. 21.2 - Billing of Fees and Charges (Rev. 1, 09-11-02) The contractor is responsible for the billing of costs resulting from providing disclosable information. To invoice, use Form CMS-633 - Invoice of Fees for FOIA Services (Exhibit C). The requester sends payment derived from the release of information to the CMS Division of Accounting. 21.3 - Advance Payment/Requests Fulfilled Without Remittance (Rev. 1, 09-11-02) Where estimated costs exceed $250.00, or if the requester has failed to pay previous bills in a timely fashion, collect fees and charges before the requested material is copied and furnished. Use the Division of Accounting, CMS's FOIA Bad Debtor Listing to determine delinquency. Notify the requester of the total estimated charges, using language similar to the following: The HHS regulations require that a charge be made to recover some of the costs incurred in the disclosure of information. The total (estimated) billable cost for the material you requested is $ ______. The cost consists of the following charges: (list here"", 'furnish all the information required on a claims form. When information is collected by telephone, the contractor will give the individual a brief oral explanation. When information is requested by mail a written notice is used. E. Method of Accessing Individual Records - General The law requires that an agency must inform an individual, upon request, whether a system of records contains a record pertaining to the individual, permit the individual to review such record and to be accompanied for the purpose of reviewing the record by a person of his or her choice. Further, the individual is permitted to obtain a copy of such record in a comprehensible form at a reasonable cost. There is a charge of 10 cents per page with all fees under $25 waived. There is no charge for searching; nor is there a charge for a copy furnished as a means of permitting an individual access to their records. Each requester shall be asked for proof of identity as well as such general information as is necessary to determine where and how to look for records about the data subject Within 10 working days of receiving a request, the contractor must decide whether to release the records. The requested information must be furnished within 30 working days unless good cause exists. An example of ""good cause"" would be an inactive record filed in a records center that cannot be obtained within 30 days. The requester should be told of the delay and given an approximate date to expect the information. If an', 'to determine where and how to look for records about the data subject Within 10 working days of receiving a request, the contractor must decide whether to release the records. The requested information must be furnished within 30 working days unless good cause exists. An example of ""good cause"" would be an inactive record filed in a records center that cannot be obtained within 30 days. The requester should be told of the delay and given an approximate date to expect the information. If an individual\'s request for information concerning themselves is not in the contractor\'s files, the contractor should advise the individual that it does not have the information and, if available elsewhere, that it is forwarding the request to the office which has it. The contractor should furnish any requested information available if the request cannot be satisfied in full. The contractor should identify requests under the Privacy Act that require referral to CMS for data in central office systems. As required by the Privacy Act, the contractor should send the request for processing, along with a copy of the', 'individual\'s request to amend a record, the contractor should, whenever practicable, complete the review and advise the individual of the results within 10 days of the receipt of the request. Prompt action should be taken wherever possible to reduce the administrative costs involved in issuing both a separate acknowledgment of the receipt of the request and a subsequent notice informing the individual of the action taken. If a contractor denies a request for correction, the individual can appeal to the system manager for the contractor\'s system of records. O. Penalties All employees must be aware of their responsibilities under the Privacy Act and guard against improper disclosure of personal information. Any officer or employee who willfully discloses individually identifiable information, the disclosure of which is prohibited by the Act, shall be guilty of a misdemeanor and fined not more than $5,000. P. Providers, Physicians, Suppliers, and the Privacy Act: 1. Confidentiality of Provider and Supplier Records Medicare information may not be accepted from providers, physicians, and other suppliers of services on a confidential basis, expressed or implied, since any medical information obtained by a contractor is subject to disclosure to the individual to whom it pertains. Contractors are to make sure their providers and other suppliers of services are aware that no medical information marked ""confidential"" will be accepted on that basis and that any medical information', '10 - The Privacy Act of 1974 (Rev. 1, 09-11-02) A. General The purpose of the Privacy Act of 1974 is to provide safeguards for individuals against an invasion of privacy by Federal agencies. Among other things, Federal agencies are required to permit an individual to: • Determine what records pertaining to the individual are collected, used, or disseminated by such agencies; • Prevent records pertaining to the individual obtained by Federal agencies for a specific purpose from being used for another purpose without the individual\'s consent; and • Gain access to information pertaining to the individual in Federal agency records, and to correct such records when appropriate. Contractors considered to be Federal agencies for purposes of administering the Privacy Act must comply with its provisions. Contractors must: • Inform each individual from whom information is requested of their rights under the Privacy Act; • Describe the method of accessing an individual\'s records; • Prepare a method of accounting for disclosures; and • Devise a method of reviewing records at the request of individuals and making corrections if appropriate. Additional information concerning Medicare privacy policies can be accessed on the CMS Web site under the Privacy Policy link at the bottom of the web page. B. Definition of ""Individual"" ""Individual"" means a living person on whom CMS has any personal (as opposed to business) information. ""Individual"" does not include so-called persons such as sole', 'survivors under Exemption 6. Under the HIPAA Privacy Rule, the personal health information of deceased as well as living persons is protected. 3. Requests for Access to Records The FOIA and Privacy Act requests will continue to be handled according to current procedures and timeliness standards. A FOIA request for access to public records requires CMS, as a Federal agency, to provide the fullest possible disclosure of its records to the public, subject to certain exceptions (e.g., proprietary information, national defense risks). The Privacy Act requires CMS to provide individuals access to their personal information maintained in a System of Records. Note that an individual’s request under the Privacy Act to access his or her records must specify a']","According to the CMS manual context provided, there is no charge for searching records when the request is made by an individual for access to their own records under the Privacy Act. Specifically, it states: ""There is no charge for searching; nor is there a charge for a copy furnished as a means of permitting an individual access to their records."" Therefore, searching records under the Privacy Act is free of charge.",1.0
Within how many working days must a contractor decide whether to release requested records?,"['to determine where and how to look for records about the data subject Within 10 working days of receiving a request, the contractor must decide whether to release the records. The requested information must be furnished within 30 working days unless good cause exists. An example of ""good cause"" would be an inactive record filed in a records center that cannot be obtained within 30 days. The requester should be told of the delay and given an approximate date to expect the information. If an individual\'s request for information concerning themselves is not in the contractor\'s files, the contractor should advise the individual that it does not have the information and, if available elsewhere, that it is forwarding the request to the office which has it. The contractor should furnish any requested information available if the request cannot be satisfied in full. The contractor should identify requests under the Privacy Act that require referral to CMS for data in central office systems. As required by the Privacy Act, the contractor should send the request for processing, along with a copy of the', 'court subpoena duces tecum that seeks records on a beneficiary or individual practitioner that are contained in a Privacy Act System of Records, when such subpoena is not accompanied by a valid authorization to release the records signed by the subject of records. (See §40.1B.) CMS requires the contractor to refer to the RO all requests for which the contractor does not have clear authority to release the records/information. Therefore, if the contractor receives a written request for records, the contractor must determine within 2 days of the receipt of the request whether it is clearly authorized to disclose the information. When able to furnish the requested materials, the contractor will furnish it whenever possible, within 20 working days. If it is not possible to furnish the materials within 20 working days, the contractor will immediately send the requester a substantive response that states that the records will be released, and explains the reason for the delay. If the contractor is not clearly authorized to release the information, it notifies the RO immediately and refers the request to the RO for handling. It sends the request, along', 'Officer can make this decision, However, the CMS Freedom of Information Officer with the concurrence of the Office of the Assistant Secretary for Public Affairs, HHS, has delegated authority to Medicare contractors to directly release certain categories of frequently requested documents that the CMS Freedom of Information Officer has previously reviewed and decided to always release. These records are called ""direct release"" records. Some are identified within this manual; others are established by the CMS Freedom of Information Officer in administrative issuances. Accordingly, within 20 working days of receipt of an FOI request, if the contractor is authorized to release all or at least some of the requested records, it will advise the requester in writing whether the request will be wholly or partially fulfilled. The CMS does not permit the contractor to issue a written denial of any request for information, except in response to the contractor\'s direct receipt of a state or local court subpoena duces tecum that seeks records on a beneficiary or individual practitioner that are contained in a Privacy Act System of Records, when such subpoena is not accompanied by a valid authorization to release the records signed by the subject of records. (See §40.1B.) CMS requires the contractor to refer to the RO all requests for which the contractor does not have clear authority to release the records/information. Therefore, if the contractor receives a written request for records,', 'furnish all the information required on a claims form. When information is collected by telephone, the contractor will give the individual a brief oral explanation. When information is requested by mail a written notice is used. E. Method of Accessing Individual Records - General The law requires that an agency must inform an individual, upon request, whether a system of records contains a record pertaining to the individual, permit the individual to review such record and to be accompanied for the purpose of reviewing the record by a person of his or her choice. Further, the individual is permitted to obtain a copy of such record in a comprehensible form at a reasonable cost. There is a charge of 10 cents per page with all fees under $25 waived. There is no charge for searching; nor is there a charge for a copy furnished as a means of permitting an individual access to their records. Each requester shall be asked for proof of identity as well as such general information as is necessary to determine where and how to look for records about the data subject Within 10 working days of receiving a request, the contractor must decide whether to release the records. The requested information must be furnished within 30 working days unless good cause exists. An example of ""good cause"" would be an inactive record filed in a records center that cannot be obtained within 30 days. The requester should be told of the delay and given an approximate date to expect the information. If an', ""below.) A copy of this response must be sent simultaneously to the provider, thus putting it on notice that its report has been requested and by whom. (For exception, see §140.3 below.) If the request is for a report submitted by a former owner of a participating facility, copies of the contractor's response should go to both the present and former owners. If the request is for a report submitted by a provider no longer participating in the program, a copy of the contractor's response should be sent to the former provider. (For both former owners and former providers the copy of the response should be sent to the last known address of the party.) If we cannot make the information available within a reasonable period of time, our response will include a brief explanation for the delay (e.g., because of the extent of searching, photocopying, or delay in securing reports from records retention centers). In addition to the provider's copy, the contractor sends a copy to the CMS regional office servicing the provider. If a contractor receives a request for information concerning providers that it does not service, it will immediately forward such request to the CMS regional office servicing the provider and will inform the requester of its action. The regional office forwards the request to the servicing contractor. 3. Exceptions to 10 Day Notice Requirement No 10-day delay in furnishing cost reports is necessary in the case of requests from:"", '(Rev. 1, 09-11-02) The contractor\'s authority to directly release certain kinds of records includes the responsibility for complete and accurate reporting on the use of this authority. The following are reporting requirements for Medicare contractors: • Fill out completely and accurately a Form CMS-632-FOIA for each ""direct release."" • Maintain in either hardcopy or electronic form a Freedom of Information Daily Log on a daily basis. This log must include the case control number, date of incoming letter, requester\'s name, subject of the request, the date received in the FOIA unit, the date the response was mailed and the invoiced fee. • Prepare, on a monthly basis, the Summary Sheet for the CMS Monthly FOIA Report (Exhibit B). This Summary Sheet aggregates data from the individual Form CMS-632. • Submit the Daily Log and Summary Sheet for a given month to your RO FOIA Coordinator by the end of the fifth work day of the following month. • Retain copies of all completed Forms CMS-632-FOI in accordance with record retention requirements for FOIA Administrative Files. 20 - Case Numbering', 'with one set of the requested records, immediately to the RO by first class mail, and clearly identifies the request as a Freedom of Information Act request. The contractor acknowledges to the requester any request referred to the RO, using the following language: Dear: We have referred your (date) Freedom of Information Act request for (specify type of information requested) to: (name of the CMS Regional Office FOIA Coordinator, address of CMS RO, and telephone number of the CMS RO Coordinator). Any questions you may have relative to your request should be directed to that office. Sincerely yours, The contractor sends a copy of the acknowledgment letter with the request to the RO. The contractor is not required to create records to comply with requests for information. Contractors may answer requests that require creation of records by stating that the requested records do not exist and that the FOIA does not require agencies to recreate records in order to respond to a request. Include the appeal rights statement set forth below in the response. (Note that deletion of non-releasable information from an existing record is not considered creation of a records, no matter how extensive or time consuming the deletion process might be. Respond to requests that require creation of records using the following language: Dear: This is in response to your request dated ____, seeking access to (specify the subject(s) of requested record). Because you seek access to one or more agency', 'The following sections contain instructions concerning the confidentiality and disclosure of information acquired and maintained by CMS, contractors (i.e., Medicare Administrative Contractors), providers, and State agencies in the administration of the health insurance program. These instructions comply with the statutes and regulations governing disclosure of information, specifically section 1106 of the Social Security Act, the Freedom of Information Act (5 USC §552) and implementing HHS FOIA regulations at 45 CFR Part 5, and CMS Confidentiality and Disclosure regulations at 42 CFR 401.101, et seq. 10.2 - Procedures for Handling Requests (Rev. 1, 09-11-02) The Freedom of Information Act (FOIA) requires that within 20 working days of the receipt of a written request for records (or information known to be contained within an agency record), Federal agencies must decide whether the records/information will or will not be disclosed. By HHS regulation, only the CMS Freedom of Information Officer can make this decision, However, the CMS Freedom of Information Officer with the concurrence of the Office of the Assistant Secretary for Public Affairs, HHS, has delegated authority to Medicare contractors to directly release certain categories of frequently requested documents that the CMS Freedom of Information Officer has previously reviewed and decided to always release. These records are called ""direct release"" records. Some are identified within this manual; others are', 'searching for and photocopying the requested material until the advance payment is received. If you do not hear from the requester in 30 days, close the request. 30 - Disclosure of Program Materials (Contractors) (Rev. 1, 09-11-02) The Freedom of Information Act deals with the right of the public to information about Government rules and methods of operating. It requires that every Federal agency make available for inspection and copying: ""522(a)(2) (B) those statements of policy and interpretations which have been adopted by the agency and are not published in the Federal Register; and (C) administrative staff manual and instructions to staff that affect any member of the public, unless such materials are promptly published and copies offered for sale."" Information contained in Medicare program manuals and Program Memoranda can be obtained via the Internet. Where requests are made to contractors, contractors will photocopy Program Memoranda and individual pages from CMS manuals to respond to minor requests. When inquirers ask to see Social Security Manuals and letters that are not maintained, the contractor will refer them to the SSO. If the request is for Medicare related information, the contractor may disclose the following: • Written policy used to evaluate and make payment decisions on claims subject to medical review. (Parameters are not components of medical payment policies and should not be disclosed.) • Fee schedules and profiles of customary and prevailing charges', 'Generally, the contractor will not honor requests for information about a specific physician or other supplier of services, or for information which would identify such a physician or other supplier of services, except in situations described in §140.1 above. Disclosure to third parties for program purposes of information about individual physicians and other suppliers who are natural persons is governed by the same restrictions and procedures as disclosure about named beneficiaries to third parties for program purposes. (See §50B of this chapter.) The contractor acknowledges such requests and refers them to the RO for response. If the information the contractor discloses is solely information that does not identify or make identifiable individuals (e.g., aggregate statistics or records on providers and other corporate entities), it uses the following language: Dear: We are prepared to make available to your organization certain social security records so that (state reason). However, before making these records available to you, we must point out that by law all information derived in the administration of the Social Security Act is subject to the provisions of the Freedom of Information Act, which exempts from disclosure certain categories of records. In order to assure that no records held confidential under the Freedom of Information Act are disclosed, you must agree to meet the following conditions before we make any social security records available to you: 1. Any']",A contractor must decide whether to release requested records within 10 working days of receiving the request.,1.0
Within how many working days must requested Privacy Act information generally be furnished?,"['to determine where and how to look for records about the data subject Within 10 working days of receiving a request, the contractor must decide whether to release the records. The requested information must be furnished within 30 working days unless good cause exists. An example of ""good cause"" would be an inactive record filed in a records center that cannot be obtained within 30 days. The requester should be told of the delay and given an approximate date to expect the information. If an individual\'s request for information concerning themselves is not in the contractor\'s files, the contractor should advise the individual that it does not have the information and, if available elsewhere, that it is forwarding the request to the office which has it. The contractor should furnish any requested information available if the request cannot be satisfied in full. The contractor should identify requests under the Privacy Act that require referral to CMS for data in central office systems. As required by the Privacy Act, the contractor should send the request for processing, along with a copy of the', 'furnish all the information required on a claims form. When information is collected by telephone, the contractor will give the individual a brief oral explanation. When information is requested by mail a written notice is used. E. Method of Accessing Individual Records - General The law requires that an agency must inform an individual, upon request, whether a system of records contains a record pertaining to the individual, permit the individual to review such record and to be accompanied for the purpose of reviewing the record by a person of his or her choice. Further, the individual is permitted to obtain a copy of such record in a comprehensible form at a reasonable cost. There is a charge of 10 cents per page with all fees under $25 waived. There is no charge for searching; nor is there a charge for a copy furnished as a means of permitting an individual access to their records. Each requester shall be asked for proof of identity as well as such general information as is necessary to determine where and how to look for records about the data subject Within 10 working days of receiving a request, the contractor must decide whether to release the records. The requested information must be furnished within 30 working days unless good cause exists. An example of ""good cause"" would be an inactive record filed in a records center that cannot be obtained within 30 days. The requester should be told of the delay and given an approximate date to expect the information. If an', 'court subpoena duces tecum that seeks records on a beneficiary or individual practitioner that are contained in a Privacy Act System of Records, when such subpoena is not accompanied by a valid authorization to release the records signed by the subject of records. (See §40.1B.) CMS requires the contractor to refer to the RO all requests for which the contractor does not have clear authority to release the records/information. Therefore, if the contractor receives a written request for records, the contractor must determine within 2 days of the receipt of the request whether it is clearly authorized to disclose the information. When able to furnish the requested materials, the contractor will furnish it whenever possible, within 20 working days. If it is not possible to furnish the materials within 20 working days, the contractor will immediately send the requester a substantive response that states that the records will be released, and explains the reason for the delay. If the contractor is not clearly authorized to release the information, it notifies the RO immediately and refers the request to the RO for handling. It sends the request, along', 'individual\'s request to amend a record, the contractor should, whenever practicable, complete the review and advise the individual of the results within 10 days of the receipt of the request. Prompt action should be taken wherever possible to reduce the administrative costs involved in issuing both a separate acknowledgment of the receipt of the request and a subsequent notice informing the individual of the action taken. If a contractor denies a request for correction, the individual can appeal to the system manager for the contractor\'s system of records. O. Penalties All employees must be aware of their responsibilities under the Privacy Act and guard against improper disclosure of personal information. Any officer or employee who willfully discloses individually identifiable information, the disclosure of which is prohibited by the Act, shall be guilty of a misdemeanor and fined not more than $5,000. P. Providers, Physicians, Suppliers, and the Privacy Act: 1. Confidentiality of Provider and Supplier Records Medicare information may not be accepted from providers, physicians, and other suppliers of services on a confidential basis, expressed or implied, since any medical information obtained by a contractor is subject to disclosure to the individual to whom it pertains. Contractors are to make sure their providers and other suppliers of services are aware that no medical information marked ""confidential"" will be accepted on that basis and that any medical information', '10 - The Privacy Act of 1974 (Rev. 1, 09-11-02) A. General The purpose of the Privacy Act of 1974 is to provide safeguards for individuals against an invasion of privacy by Federal agencies. Among other things, Federal agencies are required to permit an individual to: • Determine what records pertaining to the individual are collected, used, or disseminated by such agencies; • Prevent records pertaining to the individual obtained by Federal agencies for a specific purpose from being used for another purpose without the individual\'s consent; and • Gain access to information pertaining to the individual in Federal agency records, and to correct such records when appropriate. Contractors considered to be Federal agencies for purposes of administering the Privacy Act must comply with its provisions. Contractors must: • Inform each individual from whom information is requested of their rights under the Privacy Act; • Describe the method of accessing an individual\'s records; • Prepare a method of accounting for disclosures; and • Devise a method of reviewing records at the request of individuals and making corrections if appropriate. Additional information concerning Medicare privacy policies can be accessed on the CMS Web site under the Privacy Policy link at the bottom of the web page. B. Definition of ""Individual"" ""Individual"" means a living person on whom CMS has any personal (as opposed to business) information. ""Individual"" does not include so-called persons such as sole', ""the Privacy Act (5U.S.C. §552a) precludes release of those records except pursuant to a written authorization to release signed by the subject(s) of the records or unless the Freedom of Information Act requires release of the records or a court of competent jurisdiction orders release. Regarding the latter condition of disclosure, for purposes of the Privacy Act, a court of competent jurisdiction is a Federal court only. Review of this matter indicates that your firm has not presented a written authorization to release records signed by the subject(s) of the records. Moreover, your firm's subpoena is not an order of a court of competent jurisdiction, and 45"", ""Without Consent, information may not be disclosed without the written consent of the subject individual, or their legal guardian, or, in the case of a minor, their parent (a parent or legal guardian of a minor may not consent to the disclosure of medical information about the minor). Other persons, regardless of relationship (except members of Congress and representative payees), may not receive information about the individual without their consent. In addition, a person who receives information about an individual with the individual's consent may not authorize disclosure of that information to someone else. Awkward situations may develop from a refusal, in compliance with the Privacy Act, to divulge information to the child or spouse of an aged or infirm individual. In order to avoid lengthy and unproductive correspondence, the requester should be advised that the Privacy Act precludes our disclosing any information to anyone other than the individual to whom the information pertains without the specific written consent of that individual, but that the requested information will be sent directly to the individual concerned with an explanation of the inquiry received on their behalf. J. Disclosures to Members of Congress Information requested by members of Congress and their staffs may be disclosed as follows: • Where a member of Congress (or a staff member) inquires on behalf of a constituent, the contractor may respond to the member of Congress (MC) without the written"", 'Officer can make this decision, However, the CMS Freedom of Information Officer with the concurrence of the Office of the Assistant Secretary for Public Affairs, HHS, has delegated authority to Medicare contractors to directly release certain categories of frequently requested documents that the CMS Freedom of Information Officer has previously reviewed and decided to always release. These records are called ""direct release"" records. Some are identified within this manual; others are established by the CMS Freedom of Information Officer in administrative issuances. Accordingly, within 20 working days of receipt of an FOI request, if the contractor is authorized to release all or at least some of the requested records, it will advise the requester in writing whether the request will be wholly or partially fulfilled. The CMS does not permit the contractor to issue a written denial of any request for information, except in response to the contractor\'s direct receipt of a state or local court subpoena duces tecum that seeks records on a beneficiary or individual practitioner that are contained in a Privacy Act System of Records, when such subpoena is not accompanied by a valid authorization to release the records signed by the subject of records. (See §40.1B.) CMS requires the contractor to refer to the RO all requests for which the contractor does not have clear authority to release the records/information. Therefore, if the contractor receives a written request for records,', 'survivors under Exemption 6. Under the HIPAA Privacy Rule, the personal health information of deceased as well as living persons is protected. 3. Requests for Access to Records The FOIA and Privacy Act requests will continue to be handled according to current procedures and timeliness standards. A FOIA request for access to public records requires CMS, as a Federal agency, to provide the fullest possible disclosure of its records to the public, subject to certain exceptions (e.g., proprietary information, national defense risks). The Privacy Act requires CMS to provide individuals access to their personal information maintained in a System of Records. Note that an individual’s request under the Privacy Act to access his or her records must specify a', 'searching for and photocopying the requested material until the advance payment is received. If you do not hear from the requester in 30 days, close the request. 30 - Disclosure of Program Materials (Contractors) (Rev. 1, 09-11-02) The Freedom of Information Act deals with the right of the public to information about Government rules and methods of operating. It requires that every Federal agency make available for inspection and copying: ""522(a)(2) (B) those statements of policy and interpretations which have been adopted by the agency and are not published in the Federal Register; and (C) administrative staff manual and instructions to staff that affect any member of the public, unless such materials are promptly published and copies offered for sale."" Information contained in Medicare program manuals and Program Memoranda can be obtained via the Internet. Where requests are made to contractors, contractors will photocopy Program Memoranda and individual pages from CMS manuals to respond to minor requests. When inquirers ask to see Social Security Manuals and letters that are not maintained, the contractor will refer them to the SSO. If the request is for Medicare related information, the contractor may disclose the following: • Written policy used to evaluate and make payment decisions on claims subject to medical review. (Parameters are not components of medical payment policies and should not be disclosed.) • Fee schedules and profiles of customary and prevailing charges']","Requested Privacy Act information must generally be furnished within 30 working days of receiving the request, unless good cause exists for a delay.",1.0
How long must accounting records of disclosures be maintained?,"[""or disputed records. The accounting must enable the contractor to tell the individual when and what information about the individual was released and to whom. It is not necessary to maintain a separate record of disclosures if such information can be retrieved from the contractor's operating records. An individual has the same access rights to an accounting of disclosures as to other information, with no exception. It is not mandatory to tell an individual about disclosures made to an agency for law enforcement purposes. (Refer requests for accountings that include disclosures to law enforcement agencies to the CMS regional office.) The contractor must maintain accounting records for 5 years, or the life of the basic record, whichever is longer. The lives of various basic records are furnished in Chapter 1 of the Claims Processing Manual. N. Reviewing and Correcting Records Individuals are permitted by the Privacy Act to request correction of any record pertaining to themselves. The contractor should have a method of reviewing records at the request of the individual and making corrections where appropriate. In reviewing an"", 'compatible with the purpose for which the information was collected in the first place. An explanation of the purposes and uses of each ""routine use"" disclosure must be published in the Federal Register at least 30 days prior to the disclosure and at least annually thereafter. Current routine uses are: • Part B Payment Records • Payment Record Reference File • Tape containing amount, type, and cost of health care services. • Summary Records • Group Health Plan Membership Data • Identification Data • Group Health Membership Data • Group Health Membership List • Quality Assurance Program Releases and Corrections M. Accounting for Disclosure The Privacy Act requires that agencies account for disclosures of personal data to organizations outside DHHS or made in response to requests under the FOIA. The purposes of the accounting are: • To allow individuals to learn to whom records about themselves have been disclosed; and • To provide a basis for subsequently advising recipients of any amended or disputed records. The accounting must enable the contractor to tell the individual when and what information about the individual was released and to whom. It is not necessary to maintain a separate record of disclosures if such information can be retrieved from the contractor\'s operating records. An individual has the same access rights to an accounting of disclosures as to other information, with no exception. It is not mandatory to tell an individual about disclosures made to an agency', '5 years old. 25. Provider Statistical and Reimbursement Reports (PS&RR) - (FROZEN - DO NOT DESTROY) These files consist of EDP printouts or microforms showing summaries of payments to hospitals, skilled nursing facilities, home health agencies, and other providers of service. They are used to effect cost settlements between the A/B MACs (A) or (HHH) and the providers for program validation purposes and to determine accuracy of cost reports. These reports contain Part A and Part B inpatient and outpatient information, inpatient statistics, total bills, covered costs, and other related data. Disposition: Once the freeze is lifted, destroy 5 years after completion of audit and/or settlement process for provider cost report for corresponding fiscal year. 26. A/B MAC (B) or DME MAC Claims Processing File Consists of documents relating to Part BA/B MAC (B) or DME MAC performance. Submitted on a weekly basis electronically to CMS’s data center. Disposition: Destroy after 6 months. 30.40 - Retention of Claims File Materials (Rev. 38, Issued: 05-26-06, Effective: 06-26-06, Implementation: 06-26-06) After the claims determination payment action and posting to CMS records is completed, the bills and related materials are accumulated in file segments and held before transfer to an approved offsite storage facility (see §30.40.2). Claims records having current value and continuing reference, or claims records otherwise flagged to indicate pending action, are retained as long as the A/B', 'Disposition: Destroy 4 years after the close of the calendar year in which action on the review is completed. 20. MAC Computer Printout Records (FROZEN - DO NOT DESTROY) These consist of computer printouts used in processing, paying, and controlling Medicare claims. a. Pending and process listing, payment listing, duplicate check control, master file update control, and profiles of physicians and other suppliers of services. Disposition: Once the freeze is lifted, destroy 4 years after the close of the calendar year in which payment was made. b. Check listing and bank reconciliation. Disposition: Once the freeze is lifted, destroy 6 years after the close of the calendar year in which paid or voided. c. CWF inquiry or response listings, transaction listing, activity listings, posting exceptions, analysis of posting errors, claims inventory control, edit input transactions, and aging of open claims. Disposition: Once the freeze is lifted, destroy 3 years after processing. (Contractors with the capability of electronically retaining the CWF data may destroy the paper copies after the tapes have been verified.) 21. A/B MAC (A) or (HHH) Cost Report Files (FROZEN - DO NOT DESTROY) These consist of cost reports submitted by providers to A/B MACs (A) or (HHH) for determining Medicare reimbursable costs in accordance with regulations and the principles of reimbursement. The cost report file includes: (a) a copy of the original cost report form as filed by the provider; (b) copies of', '1. Medicare Claims Records: A. A/B MAC (A) or (HHH) Billing Records (FROZEN - DO NOT DESTROY) These files consist of Inpatient and/or Outpatient Billing forms, and other documents used to bill for services processed by A/B MACs (A) or (HHH) i.e., inpatient hospital, outpatient hospital, SNF, hospice, home health, etc. DISPOSITION: Once the freeze is lifted, cutoff at the close of the CY in which paid. Destroy 6 years and 3 months after cutoff. B. A/B MAC (B) or DME MAC Billing Records (FROZEN - DO NOT DESTROY) These files consist of Requests for Payment and similar forms. Also included are itemized bills, correspondence (including correspondence with district offices), and comparable documents used to support payment to beneficiaries, physicians, and other suppliers of services under the Supplemental Medical Insurance (SMI) Program. DISPOSITION: Once the freeze is lifted, cutoff at the close of the CY in which paid. Destroy 6 years and 3 months after cutoff. 2. Medicare Benefit Check Records (FROZEN - DO NOT DESTROY) These files consist of paid checks that contractors receive from banks covering amounts paid to providers of service, beneficiaries, physicians, and other suppliers of service under the Hospital Insurance and Supplementary Medical Insurance (SMI) programs. Also included are check vouchers and cancelled or voided checks resulting from nonreceipt, loss, theft, or non-delivery. Disposition: The contractor cuts off the file at the close of the calendar year in which', '30.40.2 - Standard Retention Periods - Microfilmed Claims (Rev. 38, Issued: 05-26-06, Effective: 06-26-06, Implementation: 06-26-06) Contractors keep each permanent claims records file segment for a period of not less than 6 months or more than 11/2 years after the segment has been closed. The contractor bases the selection of a retention period on its experience with the rate and frequency of reference and other criteria. It also should avoid too early transfer to the storage facility, which could result in volume recalls and delays. The contractor bases the exact length of the retention period on its needs and on the arrangements worked out with the storage facility. The following examples of segment accumulation and retention periods demonstrate some of the ways in which these periods can vary. EXAMPLES: Segment Files Accumulation Period Retention Period Transfer a. 6 months 7/1/05 - 12/31/05 6 months 7/1/06 1/1/06 - 6/30/06 6 months 1/1/07 1/1/06 - 6/30/06 12 months 7/1/06 1/1/06 - 6/30/06 18 months 1/1/07 b. 9 months 7/1/05 - 3/31/06 6 months 10/1/06 7/1/05 - 3/31/06 12 months 4/1/07 7/1/05 - 3/31/06 18 months 10/1/07 c. 12 months 1/1/05 - 12/31/05 6 months 7/1/06 1/1/05 - 12/31/05 12 months 1/1/07 1/1/05 - 12/31/05 18 months 7/1/07 d. 18 months 1/1/05 - 6/30/07 6 months 1/1/08 1/1/05 - 6/30/07 12 months 7/1/08 1/1/05 - 6/30/07 18 months 1/1/09', ""information about themselves to the MC (if we respond directly to the individual or with their consent, no accounting record is required). Where the inquirer is the legal guardian, or the parent of a minor, the contractor may disclose the information to the MC, but must make a record of the disclosure. • Where the MC's inquiry is in writing and does not indicate whether the request is from the subject individual, the contractor will contact the MC, usually by telephone, to clarify the situation. A copy of the reply (or a report of telephone call if the response is by telephone) will provide an adequate accounting record. The record should show the date of disclosure, the information disclosed, and to whom the disclosure was made. The contractor should file this record by name or social security claim number so that retrieval may be made expeditiously. K. Disclosure to Representative Payees An SSA-appointed representative payee is entitled to receive information on, or act on, behalf of a beneficiary to the extent necessary to protect the beneficiary's rights under title II or XVIII. L. Disclosure without Consent Below are listed the situations in which data on identifiable individuals may be released without the individual's consent. The disclosure is permitted if the disclosure would be: • To DHHS employees and officers who need the records to perform their duties; • Required by the FOIA; • To the Bureau of Census; • For research purposes under certain circumstances; • To"", '3. File accumulations of papers received at file locations on a daily basis. 4. Audit periodically a representative sample of the files for duplications, misclassification, or misfiles. The methods used in maintaining, using, and disposing of these files vary with the contractor. Variations depend on the filing and control methods established (e.g., provider number, Medicare beneficiary identifier, date, name, or other sequence) to record requests from providers; to furnish replies; to check on overdue cases; to control cases for completion of processing; to control cases requiring some type of investigation or additional documentation; to retain completed cases for history or other reference; to maintain for audits; and to schedule for transfer to other storage areas. Other variances may be due to computer or clerical practices; workload volume; review initiated at time of notice of admission, at time of start of care, at time of request for advance payment or at time of receipt of billing form; and other considerations. 30.30 - Record Retention and Disposal Schedule (Rev. 38, Issued: 05-26-06, Effective: 06-26-06, Implementation: 06-26-06) This schedule identifies those records accumulated by the contractor in administering the Medicare program and outlines the disposal schedule for each type of record. A freeze has been imposed on the destruction of Medicare records. No paper Medicare records can be destroyed unless they are electronically imaged. If Medicare records are', ""subject to proper disposal. 30.30.1.5 - Disposition for Medicare Records When Potential Fraud or Overutilization Has Been Identified (Rev. 38, Issued: 05-26-06, Effective: 06-26-06, Implementation: 06-26-06) When potential fraud or overutilization has been identified, retain the recordkeeping copy onsite. If the recordkeeping copy has already been transferred to offsite storage, retrieve and retain onsite until the investigation and subsequent legal action, if any, has been completed (including the exhaustion of all appeals), then destroy 3 months thereafter. If at the close of this period, the disposition instructions shown in §30.30.1.1 through 30.30.2 remains applicable, retain, transfer, and destroy in accordance with the disposition instructions. If the disposition instructions in §30.30.1.1 through 30.30.2 are no longer applicable, then destroy after the 3 month period following completion of the investigation or subsequent legal action, if any. If any records are provided to a prosecutorial agency as evidentiary matter, consider such records as disposed of. If any such record is returned by the prosecutorial agency, retain for 3 months, then destroy in accordance with the foregoing disposition instructions unless otherwise directed by the prosecutorial agency. 30.30.2 - Description of Records (Rev. 124, Issued: 05-17-19, Effective: 06-18-19, Implementation: 06-18-19 The term Medicare beneficiary identifier (Mbi) is a general term describing a beneficiary's Medicare"", 'form; and other considerations. 30.30 - Record Retention and Disposal Schedule (Rev. 38, Issued: 05-26-06, Effective: 06-26-06, Implementation: 06-26-06) This schedule identifies those records accumulated by the contractor in administering the Medicare program and outlines the disposal schedule for each type of record. A freeze has been imposed on the destruction of Medicare records. No paper Medicare records can be destroyed unless they are electronically imaged. If Medicare records are not imaged, the original paper document must be retained. A contractor who images paper Medicare records: A. Must always be able to demonstrate the imaged version is an exact copy of the paper document, B. Document the steps taken to image the original document, C. Establish and implement a certification/quality assurance process to ensure the imaged information is an identical replication of the paper document in every way, D. Retain the scanned image as the “recordkeeping copy” for the required retention period, and E. Maintain accessibility and the ability to read the document in accordance with changes in technology. The methods used in imaging files may vary with the contractor. These variations depend on the type of equipment used and methods used to prepare documents for imaging. All imaged documents shall be tamper proof. Once an image is verified as an exact copy of the original paper document, only then can the original paper document be destroyed and the imaged copy is certified']","Accounting records of disclosures must be maintained for 5 years, or the life of the basic record, whichever is longer.",1.0
What is the penalty for willfully disclosing information prohibited by the Privacy Act?,"['individual\'s request to amend a record, the contractor should, whenever practicable, complete the review and advise the individual of the results within 10 days of the receipt of the request. Prompt action should be taken wherever possible to reduce the administrative costs involved in issuing both a separate acknowledgment of the receipt of the request and a subsequent notice informing the individual of the action taken. If a contractor denies a request for correction, the individual can appeal to the system manager for the contractor\'s system of records. O. Penalties All employees must be aware of their responsibilities under the Privacy Act and guard against improper disclosure of personal information. Any officer or employee who willfully discloses individually identifiable information, the disclosure of which is prohibited by the Act, shall be guilty of a misdemeanor and fined not more than $5,000. P. Providers, Physicians, Suppliers, and the Privacy Act: 1. Confidentiality of Provider and Supplier Records Medicare information may not be accepted from providers, physicians, and other suppliers of services on a confidential basis, expressed or implied, since any medical information obtained by a contractor is subject to disclosure to the individual to whom it pertains. Contractors are to make sure their providers and other suppliers of services are aware that no medical information marked ""confidential"" will be accepted on that basis and that any medical information', 'envelope ""Freedom of Information Act Appeal,"" and enclose a copy of this letter. Sincerely yours, Signature of Authorized Official cc: FOI Officer, CMS Process the State or local court subpoena duces tecum that seeks other kinds of CMS records in accord with §10.2 above. C. Penalty for Failure to Comply With the Rules Relating to Disclosure of Information Obtained in the Administration of the Act Section 1106(a) of the Act provides that any person who violates the disclosure provisions shall be deemed guilty of a misdemeanor and, upon conviction thereof, shall be punished by a fine not exceeding $1,000, by imprisonment not exceeding 1 year, or both. 40.2 - The Authority for Disclosure (Rev. 1, 09-11-02) Regulation No. 1 of the Act defines the basic authorization for disclosure of information obtained in the administration of the program. The general rule is that information about an individual obtained in the administration of the program may not be disclosed without the authorization of that individual. Medical information relating to an individual will generally be disclosed under more restrictive conditions than other information and, where permitted, usually may be furnished only upon the written authorization of the individual. Specific exceptions to this rule are detailed in the following sections. As far as program operations are concerned, information about an individual may be disclosed', 'by the provisions of § 1106 if the Social Security Act as implemented by Regulation No. 1, the Privacy Act, the FOI Act, and the DHHS Public Information Regulation. 40.1 - Prohibition Against Disclosure (Rev. 1, 09-11-02) Section 1106 of the Social Security Act prohibits disclosure of any file, record, report, or other paper, or any information obtained at any time by the Secretary or an officer or employee of DHHS in the course of discharging their duties under the Act, except as prescribed by regulations. Where manual instructions permit disclosure, assume that related regulations have been published. The same prohibition applies to information received by any person outside DHHS, from the Secretary, or an officer or employee of DHHS. The prohibition applies to any agency, organization (e.g., contractors), or institution, or any of its officers or employees, in the fulfillment of a contract or agreement with the Secretary. A. Disclosure of Provider or Physician Records The prohibition also relates to any information received from DHHS, a contractor, or any person or entity that furnishes services under arrangements with a provider or accepts an assignment under the program. However, patient records in the possession of a provider', ""Without Consent, information may not be disclosed without the written consent of the subject individual, or their legal guardian, or, in the case of a minor, their parent (a parent or legal guardian of a minor may not consent to the disclosure of medical information about the minor). Other persons, regardless of relationship (except members of Congress and representative payees), may not receive information about the individual without their consent. In addition, a person who receives information about an individual with the individual's consent may not authorize disclosure of that information to someone else. Awkward situations may develop from a refusal, in compliance with the Privacy Act, to divulge information to the child or spouse of an aged or infirm individual. In order to avoid lengthy and unproductive correspondence, the requester should be advised that the Privacy Act precludes our disclosing any information to anyone other than the individual to whom the information pertains without the specific written consent of that individual, but that the requested information will be sent directly to the individual concerned with an explanation of the inquiry received on their behalf. J. Disclosures to Members of Congress Information requested by members of Congress and their staffs may be disclosed as follows: • Where a member of Congress (or a staff member) inquires on behalf of a constituent, the contractor may respond to the member of Congress (MC) without the written"", '10 - The Privacy Act of 1974 (Rev. 1, 09-11-02) A. General The purpose of the Privacy Act of 1974 is to provide safeguards for individuals against an invasion of privacy by Federal agencies. Among other things, Federal agencies are required to permit an individual to: • Determine what records pertaining to the individual are collected, used, or disseminated by such agencies; • Prevent records pertaining to the individual obtained by Federal agencies for a specific purpose from being used for another purpose without the individual\'s consent; and • Gain access to information pertaining to the individual in Federal agency records, and to correct such records when appropriate. Contractors considered to be Federal agencies for purposes of administering the Privacy Act must comply with its provisions. Contractors must: • Inform each individual from whom information is requested of their rights under the Privacy Act; • Describe the method of accessing an individual\'s records; • Prepare a method of accounting for disclosures; and • Devise a method of reviewing records at the request of individuals and making corrections if appropriate. Additional information concerning Medicare privacy policies can be accessed on the CMS Web site under the Privacy Policy link at the bottom of the web page. B. Definition of ""Individual"" ""Individual"" means a living person on whom CMS has any personal (as opposed to business) information. ""Individual"" does not include so-called persons such as sole', 'any information on identifiable individuals. You should also note that §1106(a) of the Social Security Act imposes criminal penalties for unauthorized disclosure. Any social security records which do not identify or make identifiable any individuals are not subject to these restrictions, but may be restricted under the provisions of the Freedom of Information Act. In order to comply with the requirements of the Social Security Act and Freedom of Information Act you must agree to the following conditions before we can make any social security records available to you: Any information which is turned over to you will be used only for the specific purpose intended. All employees having access to this material will be instructed as to its confidential nature. An official of your company will assume the responsibility for ensuring that the information is not revealed to another. The material must be returned to us as soon as you have finished the job. We must have a letter from a responsible official in your office agreeing to these conditions and assuming responsibility for carrying them out.', ""the Privacy Act (5U.S.C. §552a) precludes release of those records except pursuant to a written authorization to release signed by the subject(s) of the records or unless the Freedom of Information Act requires release of the records or a court of competent jurisdiction orders release. Regarding the latter condition of disclosure, for purposes of the Privacy Act, a court of competent jurisdiction is a Federal court only. Review of this matter indicates that your firm has not presented a written authorization to release records signed by the subject(s) of the records. Moreover, your firm's subpoena is not an order of a court of competent jurisdiction, and 45"", ""In each case where a minor's medical records are sent to a physician or health professional, reasonable efforts will be made by the contractor to so inform the minor. In the event the parent or guardian refuses to name a medical professional or cannot afford the fee for the service or the designated medical professional refuses to serve, the contractor will refer the file to the CMS regional office for appropriate action. H. Disclosure to Third Parties The Privacy Act permits disclosure to any third party with the written consent of the individual to whom the record pertains. It also permits disclosure in certain instances without the individual's consent. However, the contractor must not disclose information unless the disclosure is specifically authorized in this chapter, or the individual has consented to the disclosure in writing, or the CMS regional office authorizes the disclosure. I. Disclosures with Consent Except for those disclosures discussed below in §10L of this chapter, Disclosure Without Consent, information may not be disclosed without the written consent of the subject individual, or their legal guardian, or, in the case of a minor, their parent (a parent or legal guardian of a minor may not consent to the disclosure of medical information about the minor). Other persons, regardless of relationship (except members of Congress and representative payees), may not receive information about the individual without their consent. In addition, a person who receives"", 'statement should also include a name and telephone number for the beneficiary to call if there are further questions. D. Penalty A knowing failure to furnish the itemized statement shall be subject to a civil monetary penalty of up to $100 for each such failure. 180 - Cost to a Provider That Requests Information Available to the Public (Rev. 1, 09-11-02) Providers are required to pay appropriate fees for information they request pertaining to other providers, Medicare contractors, or State agencies. A provider may claim such fees as allowable costs only if it demonstrates to the contractor the information is necessary in developing and maintaining the operations of patient care facilities and activities. 190 - The Health Insurance Portability and Accountability Act (HIPAA) Privacy Rule (Rev. 7, 06-25-04) A. General Information To improve the efficiency and effectiveness of the health care system, HIPAA included provisions that required national standards for electronic health care transactions. At the same time, Congress recognized that advances in electronic technology could erode the privacy of health information. Consequently, Congress incorporated into HIPAA provisions that mandated the adoption of Federal privacy protections for individually identifiable health information. The Department of Health and Human Services issued the regulation “Standards for Privacy of Individually Identifiable Health Information”, 45 CFR Parts 160 and 164, (the HIPAA Privacy Rule) to', ""(Rev. 1, 09-11-02) Sections 3764 - 3769 set the guidelines for disclosure of information about a named beneficiary, to whom it may be disclosed, and the purposes for which it may be disclosed. In general, no information may be released except to the beneficiary (or the beneficiary's legal guardian) without the beneficiary's (or legal guardian's) explicit written authorization. In cases requiring the beneficiary's consent, the authorization may be in any form, but it must: • Be signed and dated; • Specify the individual, organizational unit, class of individuals or organizational units to which the information may be disclosed; • Specify the record(s), information, or type(s) of information which may be disclosed; and • Indicate whether the consent is a one-time or on-going release of records. A contractor will not honor a blanket consent to disclose all beneficiary records to unspecified individuals or organizational units. The disclosure of information about beneficiaries is governed by the provisions of § 1106 if the Social Security Act as implemented by Regulation No. 1, the Privacy Act, the FOI Act, and the DHHS Public Information Regulation. 40.1 - Prohibition Against Disclosure (Rev. 1, 09-11-02) Section 1106 of the Social Security Act prohibits disclosure of any file, record, report, or other paper, or any information obtained at any time by the Secretary or an officer or employee of DHHS in the course of discharging their duties under the Act, except as prescribed by""]","The penalty for willfully disclosing individually identifiable information, the disclosure of which is prohibited by the Privacy Act, is that the officer or employee shall be guilty of a misdemeanor and fined not more than $5,000.",1.0
Can medical information be disclosed directly to an individual?,"['A. Non-medical Information Non-medical information about an individual may be disclosed for other than a program purpose, to persons or organizations designated by the individual, if the individual authorizes disclosure, and if disclosure is consistent with the proper and efficient administration of the Act. B. Disclosure of Medical Information to a Physician, Institution, or Other Supplier of Services The contractor may disclose medical information to a supplier of medical services solely for the purpose of the beneficiary\'s care or treatment. Such supplier will be informed that the information is being furnished in connection with the treatment of the beneficiary and that its use should be restricted to that purpose. C. Disclosure to the Source of Medical Evidence Occasionally in the course of reviewing medical evidence submitted to substantiate a claim, contractor medical personnel may discover a medical condition of which the source of the information is unaware. (For purposes of this section, the ""source"" of the information is the part submitting the evidence.) In cases where a serious or potentially serious condition is found, the contractor may wish to inform the source of the information. If the source of the information indicates that the beneficiary is not institutionalized and the identity of the beneficiary\'s current physician is not known, the source should recommend that the beneficiary consult a physician or institution of the beneficiary\'s choice for further', 'interim response, to the systems manager listed in the Annual Publication: Systems of Records. F. Methods of Accessing Individual Medical Records The official responsible for the records, or their designated medical officer, may disclose medical information directly to the individual if the official determines, based on review of the medical evidence, that such disclosure is not likely to have an adverse effect. In such cases the responsible official will give the requested information to the individual and annotate the record to show that the disclosure was made. If the responsible official determines that direct disclosure of the medical record would be likely to have an adverse effect on the individual or does not consider themselves qualified to make such a determination, the official will disclose the medical information to the representative designated in writing by the individual. The representative must be a medical professional (licensed medical practitioner or nurse) who would be willing to review the record and discuss it with the individual. The contractor will retain a record showing the reason for its determination and a copy of the correspondence transmitting the information to the individual or to his/her medical representative. If there is sensitive medical information in the records and the individual refuses to name a medical professional or cannot afford the fee for the service, or if the designated medical professional refuses to serve, the contractor', ""In each case where a minor's medical records are sent to a physician or health professional, reasonable efforts will be made by the contractor to so inform the minor. In the event the parent or guardian refuses to name a medical professional or cannot afford the fee for the service or the designated medical professional refuses to serve, the contractor will refer the file to the CMS regional office for appropriate action. H. Disclosure to Third Parties The Privacy Act permits disclosure to any third party with the written consent of the individual to whom the record pertains. It also permits disclosure in certain instances without the individual's consent. However, the contractor must not disclose information unless the disclosure is specifically authorized in this chapter, or the individual has consented to the disclosure in writing, or the CMS regional office authorizes the disclosure. I. Disclosures with Consent Except for those disclosures discussed below in §10L of this chapter, Disclosure Without Consent, information may not be disclosed without the written consent of the subject individual, or their legal guardian, or, in the case of a minor, their parent (a parent or legal guardian of a minor may not consent to the disclosure of medical information about the minor). Other persons, regardless of relationship (except members of Congress and representative payees), may not receive information about the individual without their consent. In addition, a person who receives"", ""Without Consent, information may not be disclosed without the written consent of the subject individual, or their legal guardian, or, in the case of a minor, their parent (a parent or legal guardian of a minor may not consent to the disclosure of medical information about the minor). Other persons, regardless of relationship (except members of Congress and representative payees), may not receive information about the individual without their consent. In addition, a person who receives information about an individual with the individual's consent may not authorize disclosure of that information to someone else. Awkward situations may develop from a refusal, in compliance with the Privacy Act, to divulge information to the child or spouse of an aged or infirm individual. In order to avoid lengthy and unproductive correspondence, the requester should be advised that the Privacy Act precludes our disclosing any information to anyone other than the individual to whom the information pertains without the specific written consent of that individual, but that the requested information will be sent directly to the individual concerned with an explanation of the inquiry received on their behalf. J. Disclosures to Members of Congress Information requested by members of Congress and their staffs may be disclosed as follows: • Where a member of Congress (or a staff member) inquires on behalf of a constituent, the contractor may respond to the member of Congress (MC) without the written"", ""be willing to review the record and discuss it with the individual. The contractor will retain a record showing the reason for its determination and a copy of the correspondence transmitting the information to the individual or to his/her medical representative. If there is sensitive medical information in the records and the individual refuses to name a medical professional or cannot afford the fee for the service, or if the designated medical professional refuses to serve, the contractor will refer the file to the CMS regional office. G. Disclosure of Medical Information Relating to Minors In order to protect the privacy of a minor, a parent or authorized guardian who requests access to the minor's medical record may not be given direct access to the record. Contractors shall ask a parent or guardian who requests access to such a record to designate a physician or other professional (other than a family member) to whom the record may be sent. The physician or health professional to whom the record is sent will be asked by the contractor to consider the effect that the disclosure of the record to the parent or guardian would have on the minor in determining whether the record should be made available to the parent or guardian. The contractor will prepare a response to the parent or guardian in substantially the following form: We have completed processing your request for access to the medical records of (name)__________________________, a minor The medical records have"", 'Information such as Medicare entitlement or eligibility data may be disclosed to a beneficiary or their authorized representative (this includes the beneficiary\'s representative payee). 170.2 - Disclosure to Contractors (Rev. 1, 09-11-02) Providers and suppliers may not forward medical information to contractors on a confidential basis, expressed, or implied, since, under the Privacy Act, any medical information obtained by a contractor is subject to disclosure to the individual to whom the information pertains or to another person authorized by the individual to have access to it. Some providers and suppliers document findings on medical forms pre-printed ""confidential"" or routinely stamp all records ""confidential"" whether or not such records are ever intended for disclosure to a contractor. The contractor will accept such records only if the provider or supplier accompanies them with a signed statement indicating the following: • That the provider or supplier understands the information is subject to disclosure to the patient under the Privacy Act, and • That any words or statements that the transmitted records are confidential may be disregarded if the patient or the patient\'s representative requests them from the contractor or from CMS. 170.3 - Disclosure to Third parties for Proper Administration of the Health Insurance Program (Rev. 1, 09-11-02) Disclosure by the provider or supplier to persons other than the individual or the individual\'s authorized representative of', 'method of accounting for disclosures; and • Devise a method of reviewing records at the request of individuals and making corrections if appropriate. Additional information concerning Medicare privacy policies can be accessed on the CMS Web site under the Privacy Policy link at the bottom of the web page. B. Definition of ""Individual"" ""Individual"" means a living person on whom CMS has any personal (as opposed to business) information. ""Individual"" does not include so-called persons such as sole proprietorships, partnerships, or corporations. Except for disclosure of and access to medical information about minors, a parent or legal guardian of a minor, or a legal guardian of someone the court has declared incompetent, has the same rights as the individual to the individual\'s records. No one may act on behalf of an individual who has not been declared incompetent by a court or gain access to his/her records under the Privacy Act without the individual\'s written consent.', 'that it discloses no information which would appear to be detrimental to the individual or the individual\'s estate, i.e., unusual place or manner of death or information which could create a liability to the individual\'s estate. The contractor may disclose medical information, in form and detail consistent with proper and efficient administration of the program, when such disclosure is reasonably necessary for a title XVIII purpose. (See §50 of this chapter for further information concerning the disclosure of non-medical and medical information when necessary for a program purpose.) The contractor may disclose medical information obtained in the administration of title XVIII to a surviving relative or legal representative of the estate of the individual or to others for other than a title XVIII purpose, when such information is necessary for a determination as to what supplementary benefits or services such deceased individual was eligible to receive under a private or public hospital or medical insurance program which is consistent with the purposes and objectives of title XVIII. The contractor may disclose such information only if the individual has consented to such disclosure or a surviving relative or the legal representative of the estate consents. (See §80.1 ""Release of Title XVIII Claims Information for Complementary Insurance Purposes"" in this chapter.) 80 - Disclosure to Third Parties for Other than Program Purposes (Contractors) (Rev. 1, 09-11-02)', ""• An officer or employee of a State agency when necessary to carry out their duties under State law in the licensing or approving of hospitals, skilled nursing facilities, home health agencies, or independent laboratories, etc. Information obtained in the provider certification process is not to be disclosed to those not included in the above three categories, except as indicated in §140.3 below. However, information that a particular institution is participating in the program may be released; and information indicating the specialties for which title XVIII payment may be made for services of a particular independent laboratory may be released. This information is usually available from the Directory of Medical Providers and Suppliers of Services published by the Government Printing Office. C. Contractors' Disclosure to Third Parties Disclosure to third parties for program purposes of information about identifiable physicians and other suppliers who are natural persons is governed by the same restrictions and procedures as disclosure about named beneficiaries to third parties for program purposes. (See §50 of this chapter.) Information about unidentifiable individuals or about providers or corporate entities (e.g., clinics or independent laboratories), is not exempt from disclosure by section 1106 and regulations at 42 CFR, Part 401. However, it is not to be disclosed by third parties to which information is disclosed for program purposes. If the information the contractor"", ""information about themselves to the MC (if we respond directly to the individual or with their consent, no accounting record is required). Where the inquirer is the legal guardian, or the parent of a minor, the contractor may disclose the information to the MC, but must make a record of the disclosure. • Where the MC's inquiry is in writing and does not indicate whether the request is from the subject individual, the contractor will contact the MC, usually by telephone, to clarify the situation. A copy of the reply (or a report of telephone call if the response is by telephone) will provide an adequate accounting record. The record should show the date of disclosure, the information disclosed, and to whom the disclosure was made. The contractor should file this record by name or social security claim number so that retrieval may be made expeditiously. K. Disclosure to Representative Payees An SSA-appointed representative payee is entitled to receive information on, or act on, behalf of a beneficiary to the extent necessary to protect the beneficiary's rights under title II or XVIII. L. Disclosure without Consent Below are listed the situations in which data on identifiable individuals may be released without the individual's consent. The disclosure is permitted if the disclosure would be: • To DHHS employees and officers who need the records to perform their duties; • Required by the FOIA; • To the Bureau of Census; • For research purposes under certain circumstances; • To""]","Yes, medical information can be disclosed directly to an individual. The official responsible for the records, or their designated medical officer, may disclose medical information directly to the individual if they determine, based on a review of the medical evidence, that such disclosure is not likely to have an adverse effect on the individual. In such cases, the responsible official will provide the requested information to the individual and annotate the record to show that the disclosure was made.

If the responsible official determines that direct disclosure would likely have an adverse effect or does not consider themselves qualified to make such a determination, the medical information will be disclosed to a representative designated in writing by the individual. This representative must be a medical professional (licensed medical practitioner or nurse) willing to review the record and discuss it with the individual.

Additionally, if there is sensitive medical information and the individual refuses to name a medical professional, cannot afford the fee, or if the designated professional refuses to serve, the contractor will refer the file to the CMS regional office for appropriate action.",1.0
What happens if direct disclosure of medical information may adversely affect the individual?,"['interim response, to the systems manager listed in the Annual Publication: Systems of Records. F. Methods of Accessing Individual Medical Records The official responsible for the records, or their designated medical officer, may disclose medical information directly to the individual if the official determines, based on review of the medical evidence, that such disclosure is not likely to have an adverse effect. In such cases the responsible official will give the requested information to the individual and annotate the record to show that the disclosure was made. If the responsible official determines that direct disclosure of the medical record would be likely to have an adverse effect on the individual or does not consider themselves qualified to make such a determination, the official will disclose the medical information to the representative designated in writing by the individual. The representative must be a medical professional (licensed medical practitioner or nurse) who would be willing to review the record and discuss it with the individual. The contractor will retain a record showing the reason for its determination and a copy of the correspondence transmitting the information to the individual or to his/her medical representative. If there is sensitive medical information in the records and the individual refuses to name a medical professional or cannot afford the fee for the service, or if the designated medical professional refuses to serve, the contractor', 'A. Non-medical Information Non-medical information about an individual may be disclosed for other than a program purpose, to persons or organizations designated by the individual, if the individual authorizes disclosure, and if disclosure is consistent with the proper and efficient administration of the Act. B. Disclosure of Medical Information to a Physician, Institution, or Other Supplier of Services The contractor may disclose medical information to a supplier of medical services solely for the purpose of the beneficiary\'s care or treatment. Such supplier will be informed that the information is being furnished in connection with the treatment of the beneficiary and that its use should be restricted to that purpose. C. Disclosure to the Source of Medical Evidence Occasionally in the course of reviewing medical evidence submitted to substantiate a claim, contractor medical personnel may discover a medical condition of which the source of the information is unaware. (For purposes of this section, the ""source"" of the information is the part submitting the evidence.) In cases where a serious or potentially serious condition is found, the contractor may wish to inform the source of the information. If the source of the information indicates that the beneficiary is not institutionalized and the identity of the beneficiary\'s current physician is not known, the source should recommend that the beneficiary consult a physician or institution of the beneficiary\'s choice for further', ""In each case where a minor's medical records are sent to a physician or health professional, reasonable efforts will be made by the contractor to so inform the minor. In the event the parent or guardian refuses to name a medical professional or cannot afford the fee for the service or the designated medical professional refuses to serve, the contractor will refer the file to the CMS regional office for appropriate action. H. Disclosure to Third Parties The Privacy Act permits disclosure to any third party with the written consent of the individual to whom the record pertains. It also permits disclosure in certain instances without the individual's consent. However, the contractor must not disclose information unless the disclosure is specifically authorized in this chapter, or the individual has consented to the disclosure in writing, or the CMS regional office authorizes the disclosure. I. Disclosures with Consent Except for those disclosures discussed below in §10L of this chapter, Disclosure Without Consent, information may not be disclosed without the written consent of the subject individual, or their legal guardian, or, in the case of a minor, their parent (a parent or legal guardian of a minor may not consent to the disclosure of medical information about the minor). Other persons, regardless of relationship (except members of Congress and representative payees), may not receive information about the individual without their consent. In addition, a person who receives"", ""be willing to review the record and discuss it with the individual. The contractor will retain a record showing the reason for its determination and a copy of the correspondence transmitting the information to the individual or to his/her medical representative. If there is sensitive medical information in the records and the individual refuses to name a medical professional or cannot afford the fee for the service, or if the designated medical professional refuses to serve, the contractor will refer the file to the CMS regional office. G. Disclosure of Medical Information Relating to Minors In order to protect the privacy of a minor, a parent or authorized guardian who requests access to the minor's medical record may not be given direct access to the record. Contractors shall ask a parent or guardian who requests access to such a record to designate a physician or other professional (other than a family member) to whom the record may be sent. The physician or health professional to whom the record is sent will be asked by the contractor to consider the effect that the disclosure of the record to the parent or guardian would have on the minor in determining whether the record should be made available to the parent or guardian. The contractor will prepare a response to the parent or guardian in substantially the following form: We have completed processing your request for access to the medical records of (name)__________________________, a minor The medical records have"", 'that it discloses no information which would appear to be detrimental to the individual or the individual\'s estate, i.e., unusual place or manner of death or information which could create a liability to the individual\'s estate. The contractor may disclose medical information, in form and detail consistent with proper and efficient administration of the program, when such disclosure is reasonably necessary for a title XVIII purpose. (See §50 of this chapter for further information concerning the disclosure of non-medical and medical information when necessary for a program purpose.) The contractor may disclose medical information obtained in the administration of title XVIII to a surviving relative or legal representative of the estate of the individual or to others for other than a title XVIII purpose, when such information is necessary for a determination as to what supplementary benefits or services such deceased individual was eligible to receive under a private or public hospital or medical insurance program which is consistent with the purposes and objectives of title XVIII. The contractor may disclose such information only if the individual has consented to such disclosure or a surviving relative or the legal representative of the estate consents. (See §80.1 ""Release of Title XVIII Claims Information for Complementary Insurance Purposes"" in this chapter.) 80 - Disclosure to Third Parties for Other than Program Purposes (Contractors) (Rev. 1, 09-11-02)', ""Without Consent, information may not be disclosed without the written consent of the subject individual, or their legal guardian, or, in the case of a minor, their parent (a parent or legal guardian of a minor may not consent to the disclosure of medical information about the minor). Other persons, regardless of relationship (except members of Congress and representative payees), may not receive information about the individual without their consent. In addition, a person who receives information about an individual with the individual's consent may not authorize disclosure of that information to someone else. Awkward situations may develop from a refusal, in compliance with the Privacy Act, to divulge information to the child or spouse of an aged or infirm individual. In order to avoid lengthy and unproductive correspondence, the requester should be advised that the Privacy Act precludes our disclosing any information to anyone other than the individual to whom the information pertains without the specific written consent of that individual, but that the requested information will be sent directly to the individual concerned with an explanation of the inquiry received on their behalf. J. Disclosures to Members of Congress Information requested by members of Congress and their staffs may be disclosed as follows: • Where a member of Congress (or a staff member) inquires on behalf of a constituent, the contractor may respond to the member of Congress (MC) without the written"", 'kept confidential (20 CFR Part 405.126). These records may also be subject to State or local laws governing disclosure. Providers are also responsible for following conditions for coverage. A provider or supplier that receives a request for disclosure of information about a Medicare beneficiary, Medicare claim, or related information that it may not disclose, should refer the requestor to the appropriate contractor for further consideration of the request. 170.1 - Disclosure of Health Insurance Information to a Beneficiary or in Connection With a Claim (Rev. 1, 09-11-02)', 'or physician are not subject to the prohibition against disclosure or to the Departmental rules and regulations concerning confidentiality merely because the patient is entitled to Medicare benefits. Disclosure of provider or physician records not in the possession of CMS or a contractor may, however, be subject to applicable State or local laws, or to hospital rules governing disclosure. B. Authority for Refusal to Disclose Information Denial of all or portions of requested records can only be made by the CMS Freedom of Information Officer. Therefore, when a request for information is received, disclosure of which is prohibited under these guidelines, the contractor will follow §10.2 above. The CMS FOIA Officer has authorized Medicare contractors to issue a denial on his/her behalf in the following situation: If any officer, employee, agent or subcontractor is served a subpoena or other compulsory process requiring the production of records or information on a beneficiary or individual practitioner that are contained in a Privacy Act System of records and such a request is not accompanied by a valid authorization to release the records signed by the subject of the records, he/she will decline to produce the records or information. He/she will base the refusal on §1106 of the Social Security Act and on 5 USC §552a, 5 USC §552, 45 CFR Part 2 and 45 CFR Part 5. The contractor will notify the RO immediately. If the contractor directly receives such a subpoena, it uses the', 'of a beneficiary to the extent necessary to protect the beneficiary\'s rights under title II or XVIII. L. Disclosure without Consent Below are listed the situations in which data on identifiable individuals may be released without the individual\'s consent. The disclosure is permitted if the disclosure would be: • To DHHS employees and officers who need the records to perform their duties; • Required by the FOIA; • To the Bureau of Census; • For research purposes under certain circumstances; • To the National Archives; • For law enforcement activities if the activity is authorized by law and the request is from the head of the agency and specifies the particular record desired and the law enforcement activity for which the record is sought; • For compelling circumstances affecting the health and safety of any person if notice of the disclosure is sent to the last known address of the individual; • To either House of Congress or to any congressional committee or subcommittee (see section I above for requests from members of Congress on behalf of constituents); • To the Comptroller General or an authorized representative to perform the duties of the General Accounting Office; • Pursuant to the order of a court of competent jurisdiction; • For a ""routine use"" - A ""routine use"" is a disclosure of information which may be made without the individual\'s written consent because the disclosure is', 'to condition treatment, payment, enrollment or eligibility for benefits on the authorization, e.g., “I understand refusal to authorize disclosure of my personal medical information will have no effect on my enrollment, eligibility for benefits, or the amount Medicare pays for the health services I receive”; 3. The potential for information disclosed pursuant to the authorization to be subject to redisclosure by the recipient and no longer protected, e.g.: “Your personal medical information that you authorize Medicare to disclose may be subject to redisclosure and no longer protected by law.”']","If the responsible official determines that direct disclosure of the medical record would be likely to have an adverse effect on the individual or does not consider themselves qualified to make such a determination, the official will disclose the medical information to a representative designated in writing by the individual. This representative must be a medical professional (licensed medical practitioner or nurse) who is willing to review the record and discuss it with the individual. The contractor will retain a record showing the reason for its determination and a copy of the correspondence transmitting the information to the individual or to his/her medical representative.

If there is sensitive medical information in the records and the individual refuses to name a medical professional, cannot afford the fee for the service, or if the designated medical professional refuses to serve, the contractor will refer the file to the CMS regional office for appropriate action.",1.0
Can a parent directly access a minor's medical records?,"[""be willing to review the record and discuss it with the individual. The contractor will retain a record showing the reason for its determination and a copy of the correspondence transmitting the information to the individual or to his/her medical representative. If there is sensitive medical information in the records and the individual refuses to name a medical professional or cannot afford the fee for the service, or if the designated medical professional refuses to serve, the contractor will refer the file to the CMS regional office. G. Disclosure of Medical Information Relating to Minors In order to protect the privacy of a minor, a parent or authorized guardian who requests access to the minor's medical record may not be given direct access to the record. Contractors shall ask a parent or guardian who requests access to such a record to designate a physician or other professional (other than a family member) to whom the record may be sent. The physician or health professional to whom the record is sent will be asked by the contractor to consider the effect that the disclosure of the record to the parent or guardian would have on the minor in determining whether the record should be made available to the parent or guardian. The contractor will prepare a response to the parent or guardian in substantially the following form: We have completed processing your request for access to the medical records of (name)__________________________, a minor The medical records have"", 'to whom the record is sent will be asked by the contractor to consider the effect that the disclosure of the record to the parent or guardian would have on the minor in determining whether the record should be made available to the parent or guardian. The contractor will prepare a response to the parent or guardian in substantially the following form: We have completed processing your request for access to the medical records of (name)__________________________, a minor The medical records have been sent to (name and address of designated health professional) in accordance with your instructions', ""In each case where a minor's medical records are sent to a physician or health professional, reasonable efforts will be made by the contractor to so inform the minor. In the event the parent or guardian refuses to name a medical professional or cannot afford the fee for the service or the designated medical professional refuses to serve, the contractor will refer the file to the CMS regional office for appropriate action. H. Disclosure to Third Parties The Privacy Act permits disclosure to any third party with the written consent of the individual to whom the record pertains. It also permits disclosure in certain instances without the individual's consent. However, the contractor must not disclose information unless the disclosure is specifically authorized in this chapter, or the individual has consented to the disclosure in writing, or the CMS regional office authorizes the disclosure. I. Disclosures with Consent Except for those disclosures discussed below in §10L of this chapter, Disclosure Without Consent, information may not be disclosed without the written consent of the subject individual, or their legal guardian, or, in the case of a minor, their parent (a parent or legal guardian of a minor may not consent to the disclosure of medical information about the minor). Other persons, regardless of relationship (except members of Congress and representative payees), may not receive information about the individual without their consent. In addition, a person who receives"", 'interim response, to the systems manager listed in the Annual Publication: Systems of Records. F. Methods of Accessing Individual Medical Records The official responsible for the records, or their designated medical officer, may disclose medical information directly to the individual if the official determines, based on review of the medical evidence, that such disclosure is not likely to have an adverse effect. In such cases the responsible official will give the requested information to the individual and annotate the record to show that the disclosure was made. If the responsible official determines that direct disclosure of the medical record would be likely to have an adverse effect on the individual or does not consider themselves qualified to make such a determination, the official will disclose the medical information to the representative designated in writing by the individual. The representative must be a medical professional (licensed medical practitioner or nurse) who would be willing to review the record and discuss it with the individual. The contractor will retain a record showing the reason for its determination and a copy of the correspondence transmitting the information to the individual or to his/her medical representative. If there is sensitive medical information in the records and the individual refuses to name a medical professional or cannot afford the fee for the service, or if the designated medical professional refuses to serve, the contractor', ""Without Consent, information may not be disclosed without the written consent of the subject individual, or their legal guardian, or, in the case of a minor, their parent (a parent or legal guardian of a minor may not consent to the disclosure of medical information about the minor). Other persons, regardless of relationship (except members of Congress and representative payees), may not receive information about the individual without their consent. In addition, a person who receives information about an individual with the individual's consent may not authorize disclosure of that information to someone else. Awkward situations may develop from a refusal, in compliance with the Privacy Act, to divulge information to the child or spouse of an aged or infirm individual. In order to avoid lengthy and unproductive correspondence, the requester should be advised that the Privacy Act precludes our disclosing any information to anyone other than the individual to whom the information pertains without the specific written consent of that individual, but that the requested information will be sent directly to the individual concerned with an explanation of the inquiry received on their behalf. J. Disclosures to Members of Congress Information requested by members of Congress and their staffs may be disclosed as follows: • Where a member of Congress (or a staff member) inquires on behalf of a constituent, the contractor may respond to the member of Congress (MC) without the written"", ""C. Physicians' and Suppliers' Rights to Access Under the Privacy Act Providers, physicians, and suppliers as business entities do not have access to business information about themselves under the Privacy Act, since the Privacy Act concerns individuals only. However, a physician or other supplier who is also an individual has the same access rights as any other individual to personal information maintained about themselves. Purely business information which is retrievable by the physician's unique identifier is not subject to the Privacy Act, but it may be disclosed to the physician to the extent that we would not deny the physician the information under the Freedom of Information Act (FOIA). D. Informing Individuals of Rights The contractor must inform the individual of his/her rights under the Privacy Act when it solicits any information directly from the beneficiary in connection with a Medicare claim. This would usually be a result of the failure of the individual or provider to furnish all the information required on a claims form. When information is collected by telephone, the contractor will give the individual a brief oral explanation. When information is requested by mail a written notice is used. E. Method of Accessing Individual Records - General The law requires that an agency must inform an individual, upon request, whether a system of records contains a record pertaining to the individual, permit the individual to review such record and to be accompanied for"", 'survivors under Exemption 6. Under the HIPAA Privacy Rule, the personal health information of deceased as well as living persons is protected. 3. Requests for Access to Records The FOIA and Privacy Act requests will continue to be handled according to current procedures and timeliness standards. A FOIA request for access to public records requires CMS, as a Federal agency, to provide the fullest possible disclosure of its records to the public, subject to certain exceptions (e.g., proprietary information, national defense risks). The Privacy Act requires CMS to provide individuals access to their personal information maintained in a System of Records. Note that an individual’s request under the Privacy Act to access his or her records must specify a', 'or physician are not subject to the prohibition against disclosure or to the Departmental rules and regulations concerning confidentiality merely because the patient is entitled to Medicare benefits. Disclosure of provider or physician records not in the possession of CMS or a contractor may, however, be subject to applicable State or local laws, or to hospital rules governing disclosure. B. Authority for Refusal to Disclose Information Denial of all or portions of requested records can only be made by the CMS Freedom of Information Officer. Therefore, when a request for information is received, disclosure of which is prohibited under these guidelines, the contractor will follow §10.2 above. The CMS FOIA Officer has authorized Medicare contractors to issue a denial on his/her behalf in the following situation: If any officer, employee, agent or subcontractor is served a subpoena or other compulsory process requiring the production of records or information on a beneficiary or individual practitioner that are contained in a Privacy Act System of records and such a request is not accompanied by a valid authorization to release the records signed by the subject of the records, he/she will decline to produce the records or information. He/she will base the refusal on §1106 of the Social Security Act and on 5 USC §552a, 5 USC §552, 45 CFR Part 2 and 45 CFR Part 5. The contractor will notify the RO immediately. If the contractor directly receives such a subpoena, it uses the', 'method of accounting for disclosures; and • Devise a method of reviewing records at the request of individuals and making corrections if appropriate. Additional information concerning Medicare privacy policies can be accessed on the CMS Web site under the Privacy Policy link at the bottom of the web page. B. Definition of ""Individual"" ""Individual"" means a living person on whom CMS has any personal (as opposed to business) information. ""Individual"" does not include so-called persons such as sole proprietorships, partnerships, or corporations. Except for disclosure of and access to medical information about minors, a parent or legal guardian of a minor, or a legal guardian of someone the court has declared incompetent, has the same rights as the individual to the individual\'s records. No one may act on behalf of an individual who has not been declared incompetent by a court or gain access to his/her records under the Privacy Act without the individual\'s written consent.', 'A. Non-medical Information Non-medical information about an individual may be disclosed for other than a program purpose, to persons or organizations designated by the individual, if the individual authorizes disclosure, and if disclosure is consistent with the proper and efficient administration of the Act. B. Disclosure of Medical Information to a Physician, Institution, or Other Supplier of Services The contractor may disclose medical information to a supplier of medical services solely for the purpose of the beneficiary\'s care or treatment. Such supplier will be informed that the information is being furnished in connection with the treatment of the beneficiary and that its use should be restricted to that purpose. C. Disclosure to the Source of Medical Evidence Occasionally in the course of reviewing medical evidence submitted to substantiate a claim, contractor medical personnel may discover a medical condition of which the source of the information is unaware. (For purposes of this section, the ""source"" of the information is the part submitting the evidence.) In cases where a serious or potentially serious condition is found, the contractor may wish to inform the source of the information. If the source of the information indicates that the beneficiary is not institutionalized and the identity of the beneficiary\'s current physician is not known, the source should recommend that the beneficiary consult a physician or institution of the beneficiary\'s choice for further']","No, a parent or authorized guardian who requests access to a minor's medical record may not be given direct access to the record. Instead, contractors shall ask the parent or guardian to designate a physician or other health professional (other than a family member) to whom the record may be sent. This designated professional will consider the effect that disclosure to the parent or guardian would have on the minor in determining whether the record should be made available to the parent or guardian. If the parent or guardian refuses to name a medical professional, cannot afford the fee for the service, or if the designated professional refuses to serve, the contractor will refer the file to the CMS regional office for appropriate action.",1.0
Can Medicare information be disclosed to a spouse without the beneficiary's consent?,"['of a beneficiary to the extent necessary to protect the beneficiary\'s rights under title II or XVIII. L. Disclosure without Consent Below are listed the situations in which data on identifiable individuals may be released without the individual\'s consent. The disclosure is permitted if the disclosure would be: • To DHHS employees and officers who need the records to perform their duties; • Required by the FOIA; • To the Bureau of Census; • For research purposes under certain circumstances; • To the National Archives; • For law enforcement activities if the activity is authorized by law and the request is from the head of the agency and specifies the particular record desired and the law enforcement activity for which the record is sought; • For compelling circumstances affecting the health and safety of any person if notice of the disclosure is sent to the last known address of the individual; • To either House of Congress or to any congressional committee or subcommittee (see section I above for requests from members of Congress on behalf of constituents); • To the Comptroller General or an authorized representative to perform the duties of the General Accounting Office; • Pursuant to the order of a court of competent jurisdiction; • For a ""routine use"" - A ""routine use"" is a disclosure of information which may be made without the individual\'s written consent because the disclosure is', ""(Rev. 1, 09-11-02) Sections 3764 - 3769 set the guidelines for disclosure of information about a named beneficiary, to whom it may be disclosed, and the purposes for which it may be disclosed. In general, no information may be released except to the beneficiary (or the beneficiary's legal guardian) without the beneficiary's (or legal guardian's) explicit written authorization. In cases requiring the beneficiary's consent, the authorization may be in any form, but it must: • Be signed and dated; • Specify the individual, organizational unit, class of individuals or organizational units to which the information may be disclosed; • Specify the record(s), information, or type(s) of information which may be disclosed; and • Indicate whether the consent is a one-time or on-going release of records. A contractor will not honor a blanket consent to disclose all beneficiary records to unspecified individuals or organizational units. The disclosure of information about beneficiaries is governed by the provisions of § 1106 if the Social Security Act as implemented by Regulation No. 1, the Privacy Act, the FOI Act, and the DHHS Public Information Regulation. 40.1 - Prohibition Against Disclosure (Rev. 1, 09-11-02) Section 1106 of the Social Security Act prohibits disclosure of any file, record, report, or other paper, or any information obtained at any time by the Secretary or an officer or employee of DHHS in the course of discharging their duties under the Act, except as prescribed by"", ""Without Consent, information may not be disclosed without the written consent of the subject individual, or their legal guardian, or, in the case of a minor, their parent (a parent or legal guardian of a minor may not consent to the disclosure of medical information about the minor). Other persons, regardless of relationship (except members of Congress and representative payees), may not receive information about the individual without their consent. In addition, a person who receives information about an individual with the individual's consent may not authorize disclosure of that information to someone else. Awkward situations may develop from a refusal, in compliance with the Privacy Act, to divulge information to the child or spouse of an aged or infirm individual. In order to avoid lengthy and unproductive correspondence, the requester should be advised that the Privacy Act precludes our disclosing any information to anyone other than the individual to whom the information pertains without the specific written consent of that individual, but that the requested information will be sent directly to the individual concerned with an explanation of the inquiry received on their behalf. J. Disclosures to Members of Congress Information requested by members of Congress and their staffs may be disclosed as follows: • Where a member of Congress (or a staff member) inquires on behalf of a constituent, the contractor may respond to the member of Congress (MC) without the written"", ""provider, physician or supplier understands that the information is subject to disclosure at the request of the patient or his/her representative under the Privacy Act. 2. Release of Eligibility Data to Providers and Suppliers When the Individual is Unable to Sign an Authorization In situations such as the admission to a hospital of an unconscious person, where the individual has not signed a statement authorizing the provider to pursue a Medicare claim, the disclosure of Medicare information to the provider should be treated as a routine use disclosure. If the individual has authorized the provider or supplier to pursue a Medicare claim, the release of information may be treated as a disclosure made with the beneficiary's consent. 10.1 - Disclosure of Information (Rev. 1, 09-11-02)"", 'kept confidential (20 CFR Part 405.126). These records may also be subject to State or local laws governing disclosure. Providers are also responsible for following conditions for coverage. A provider or supplier that receives a request for disclosure of information about a Medicare beneficiary, Medicare claim, or related information that it may not disclose, should refer the requestor to the appropriate contractor for further consideration of the request. 170.1 - Disclosure of Health Insurance Information to a Beneficiary or in Connection With a Claim (Rev. 1, 09-11-02)', 'titles I, X, or XVI of the Social Security Act with the authorization of the individual or their authorized representative. Medical information beyond that shown on billing forms relating to an individual (and obtained in the administration of the Medicare program) may be disclosed to a State agency administering the grants-in-aid program if the State agency shows a special need for the information, and the file contains a written authorization by the beneficiary specifically consenting to disclosure of medical information.', 'Information such as Medicare entitlement or eligibility data may be disclosed to a beneficiary or their authorized representative (this includes the beneficiary\'s representative payee). 170.2 - Disclosure to Contractors (Rev. 1, 09-11-02) Providers and suppliers may not forward medical information to contractors on a confidential basis, expressed, or implied, since, under the Privacy Act, any medical information obtained by a contractor is subject to disclosure to the individual to whom the information pertains or to another person authorized by the individual to have access to it. Some providers and suppliers document findings on medical forms pre-printed ""confidential"" or routinely stamp all records ""confidential"" whether or not such records are ever intended for disclosure to a contractor. The contractor will accept such records only if the provider or supplier accompanies them with a signed statement indicating the following: • That the provider or supplier understands the information is subject to disclosure to the patient under the Privacy Act, and • That any words or statements that the transmitted records are confidential may be disregarded if the patient or the patient\'s representative requests them from the contractor or from CMS. 170.3 - Disclosure to Third parties for Proper Administration of the Health Insurance Program (Rev. 1, 09-11-02) Disclosure by the provider or supplier to persons other than the individual or the individual\'s authorized representative of', 'A. Non-medical Information Non-medical information about an individual may be disclosed for other than a program purpose, to persons or organizations designated by the individual, if the individual authorizes disclosure, and if disclosure is consistent with the proper and efficient administration of the Act. B. Disclosure of Medical Information to a Physician, Institution, or Other Supplier of Services The contractor may disclose medical information to a supplier of medical services solely for the purpose of the beneficiary\'s care or treatment. Such supplier will be informed that the information is being furnished in connection with the treatment of the beneficiary and that its use should be restricted to that purpose. C. Disclosure to the Source of Medical Evidence Occasionally in the course of reviewing medical evidence submitted to substantiate a claim, contractor medical personnel may discover a medical condition of which the source of the information is unaware. (For purposes of this section, the ""source"" of the information is the part submitting the evidence.) In cases where a serious or potentially serious condition is found, the contractor may wish to inform the source of the information. If the source of the information indicates that the beneficiary is not institutionalized and the identity of the beneficiary\'s current physician is not known, the source should recommend that the beneficiary consult a physician or institution of the beneficiary\'s choice for further', ""In each case where a minor's medical records are sent to a physician or health professional, reasonable efforts will be made by the contractor to so inform the minor. In the event the parent or guardian refuses to name a medical professional or cannot afford the fee for the service or the designated medical professional refuses to serve, the contractor will refer the file to the CMS regional office for appropriate action. H. Disclosure to Third Parties The Privacy Act permits disclosure to any third party with the written consent of the individual to whom the record pertains. It also permits disclosure in certain instances without the individual's consent. However, the contractor must not disclose information unless the disclosure is specifically authorized in this chapter, or the individual has consented to the disclosure in writing, or the CMS regional office authorizes the disclosure. I. Disclosures with Consent Except for those disclosures discussed below in §10L of this chapter, Disclosure Without Consent, information may not be disclosed without the written consent of the subject individual, or their legal guardian, or, in the case of a minor, their parent (a parent or legal guardian of a minor may not consent to the disclosure of medical information about the minor). Other persons, regardless of relationship (except members of Congress and representative payees), may not receive information about the individual without their consent. In addition, a person who receives"", 'this section, the ""source"" of the information is the part submitting the evidence.) In cases where a serious or potentially serious condition is found, the contractor may wish to inform the source of the information. If the source of the information indicates that the beneficiary is not institutionalized and the identity of the beneficiary\'s current physician is not known, the source should recommend that the beneficiary consult a physician or institution of the beneficiary\'s choice for further treatment. D. Disclosure to a Source of Medical Services other Than the Source of the Information Medical information may also be disclosed, upon request, to the beneficiary\'s physician or to a medial institution at which the beneficiary is or was a patient when such physician or institution is not the source of the information. However, consent for the release must be obtained from the beneficiary. 80.1 - Release for Title XVIII Claims Information for Complementary Insurance Purposes (Contractors) (Rev. 1, 09-11-02) The contractor may not release or use information obtained in the administration of the Medicare program for non-program activities. However, when the beneficiary has given written authorization the contractor is permitted to release certain information to its complementary insurance program under specific conditions in its capacity as insurance writer or administrator, or to other insurers for complementary health benefits purposes. Under no circumstances may the']","No, Medicare information may not be disclosed to a spouse without the beneficiary's explicit written consent. According to the CMS manual, information about a beneficiary cannot be released to anyone other than the individual or their legal guardian without the beneficiary's written authorization. This includes spouses; they are not exempt from the consent requirement. The only exceptions to disclosure without consent are specifically authorized situations such as disclosures to members of Congress on behalf of constituents or other legally mandated circumstances. Therefore, without the beneficiary's consent, Medicare information cannot be disclosed to a spouse.",1.0
Can a person who receives information with consent authorize disclosure to someone else?,"[""Without Consent, information may not be disclosed without the written consent of the subject individual, or their legal guardian, or, in the case of a minor, their parent (a parent or legal guardian of a minor may not consent to the disclosure of medical information about the minor). Other persons, regardless of relationship (except members of Congress and representative payees), may not receive information about the individual without their consent. In addition, a person who receives information about an individual with the individual's consent may not authorize disclosure of that information to someone else. Awkward situations may develop from a refusal, in compliance with the Privacy Act, to divulge information to the child or spouse of an aged or infirm individual. In order to avoid lengthy and unproductive correspondence, the requester should be advised that the Privacy Act precludes our disclosing any information to anyone other than the individual to whom the information pertains without the specific written consent of that individual, but that the requested information will be sent directly to the individual concerned with an explanation of the inquiry received on their behalf. J. Disclosures to Members of Congress Information requested by members of Congress and their staffs may be disclosed as follows: • Where a member of Congress (or a staff member) inquires on behalf of a constituent, the contractor may respond to the member of Congress (MC) without the written"", ""In each case where a minor's medical records are sent to a physician or health professional, reasonable efforts will be made by the contractor to so inform the minor. In the event the parent or guardian refuses to name a medical professional or cannot afford the fee for the service or the designated medical professional refuses to serve, the contractor will refer the file to the CMS regional office for appropriate action. H. Disclosure to Third Parties The Privacy Act permits disclosure to any third party with the written consent of the individual to whom the record pertains. It also permits disclosure in certain instances without the individual's consent. However, the contractor must not disclose information unless the disclosure is specifically authorized in this chapter, or the individual has consented to the disclosure in writing, or the CMS regional office authorizes the disclosure. I. Disclosures with Consent Except for those disclosures discussed below in §10L of this chapter, Disclosure Without Consent, information may not be disclosed without the written consent of the subject individual, or their legal guardian, or, in the case of a minor, their parent (a parent or legal guardian of a minor may not consent to the disclosure of medical information about the minor). Other persons, regardless of relationship (except members of Congress and representative payees), may not receive information about the individual without their consent. In addition, a person who receives"", ""information about themselves to the MC (if we respond directly to the individual or with their consent, no accounting record is required). Where the inquirer is the legal guardian, or the parent of a minor, the contractor may disclose the information to the MC, but must make a record of the disclosure. • Where the MC's inquiry is in writing and does not indicate whether the request is from the subject individual, the contractor will contact the MC, usually by telephone, to clarify the situation. A copy of the reply (or a report of telephone call if the response is by telephone) will provide an adequate accounting record. The record should show the date of disclosure, the information disclosed, and to whom the disclosure was made. The contractor should file this record by name or social security claim number so that retrieval may be made expeditiously. K. Disclosure to Representative Payees An SSA-appointed representative payee is entitled to receive information on, or act on, behalf of a beneficiary to the extent necessary to protect the beneficiary's rights under title II or XVIII. L. Disclosure without Consent Below are listed the situations in which data on identifiable individuals may be released without the individual's consent. The disclosure is permitted if the disclosure would be: • To DHHS employees and officers who need the records to perform their duties; • Required by the FOIA; • To the Bureau of Census; • For research purposes under certain circumstances; • To"", ""include all of the following: • The name of the organization (e.g., hospital name) that is to make the disclosure; • The name or title of the person or organization to which disclosure is to be made (e.g., CMS, including the appropriate MAC, specified by name); • The name of the patient; • The purpose or need for the information to be disclosed (e.g., for processing a claim for Medicare payment and for such evaluation of the treatment program as is legally and administratively required in the overall conduct of the Medicare program); • The specific extent or nature of information to be disclosed (e.g., all medical records regarding the beneficiary's treatment, hospitalization, and/or outpatient care including treatment for drug abuse or alcoholism); • A statement that the beneficiary may revoke their consent at any time to prohibit disclosures on or after date or revocation; • A statement specifying a date (not to exceed 2 years), event, or condition upon which consent expires without revocation; • The date on which the consent is signed; and • The signature of the patient or the signature of their authorized or legal representative. If the beneficiary wishes, the consent statement may be expanded to permit disclosure by the provider to any other person, organization, or program (e.g., PRO), as appropriate. Providers may also give authorization to CMS and its contractors to re-disclose specific information to third party payers for complementary insurance purposes."", ""provider, physician or supplier understands that the information is subject to disclosure at the request of the patient or his/her representative under the Privacy Act. 2. Release of Eligibility Data to Providers and Suppliers When the Individual is Unable to Sign an Authorization In situations such as the admission to a hospital of an unconscious person, where the individual has not signed a statement authorizing the provider to pursue a Medicare claim, the disclosure of Medicare information to the provider should be treated as a routine use disclosure. If the individual has authorized the provider or supplier to pursue a Medicare claim, the release of information may be treated as a disclosure made with the beneficiary's consent. 10.1 - Disclosure of Information (Rev. 1, 09-11-02)"", 'to condition treatment, payment, enrollment or eligibility for benefits on the authorization, e.g., “I understand refusal to authorize disclosure of my personal medical information will have no effect on my enrollment, eligibility for benefits, or the amount Medicare pays for the health services I receive”; 3. The potential for information disclosed pursuant to the authorization to be subject to redisclosure by the recipient and no longer protected, e.g.: “Your personal medical information that you authorize Medicare to disclose may be subject to redisclosure and no longer protected by law.”', 'this section, the ""source"" of the information is the part submitting the evidence.) In cases where a serious or potentially serious condition is found, the contractor may wish to inform the source of the information. If the source of the information indicates that the beneficiary is not institutionalized and the identity of the beneficiary\'s current physician is not known, the source should recommend that the beneficiary consult a physician or institution of the beneficiary\'s choice for further treatment. D. Disclosure to a Source of Medical Services other Than the Source of the Information Medical information may also be disclosed, upon request, to the beneficiary\'s physician or to a medial institution at which the beneficiary is or was a patient when such physician or institution is not the source of the information. However, consent for the release must be obtained from the beneficiary. 80.1 - Release for Title XVIII Claims Information for Complementary Insurance Purposes (Contractors) (Rev. 1, 09-11-02) The contractor may not release or use information obtained in the administration of the Medicare program for non-program activities. However, when the beneficiary has given written authorization the contractor is permitted to release certain information to its complementary insurance program under specific conditions in its capacity as insurance writer or administrator, or to other insurers for complementary health benefits purposes. Under no circumstances may the', ""If someone other than the beneficiary, legal guardian, or authorized representative has authorized disclosure to a third party by filling out the appropriate item on the billing form, the contractor may not release the information unless an authorization from the beneficiary is on file. Instead, where feasible, the contractor will inform the beneficiary (or legal guardian or authorized representative) that the signature on the claims form does not constitute a proper authorization for disclosure and that, if the beneficiary desires information to be disclosed to a third party, the beneficiary should send to either the contractor or the third party, a statement authorizing release. (The contractor will indicate the necessary contents of a proper authorization or enclose an appropriate form or statement for use by the proper party in authorizing release.) If invalid authorizations are a frequent problem, the contractor advises third party payers to obtain appropriate ongoing consent statements from enrollees. C. Methods of Handling Requests Where the complementary insurers desire title XVIII information for certain claims only, either the complementary insurer or the beneficiary may request its release. The complementary insurer must furnish the required authorization(s) for release and must pay any charges. (The Medicare program will absorb charges for supplying duplicate MSN's or billing forms to beneficiaries, their authorized representatives, and to social security"", 'A. Non-medical Information Non-medical information about an individual may be disclosed for other than a program purpose, to persons or organizations designated by the individual, if the individual authorizes disclosure, and if disclosure is consistent with the proper and efficient administration of the Act. B. Disclosure of Medical Information to a Physician, Institution, or Other Supplier of Services The contractor may disclose medical information to a supplier of medical services solely for the purpose of the beneficiary\'s care or treatment. Such supplier will be informed that the information is being furnished in connection with the treatment of the beneficiary and that its use should be restricted to that purpose. C. Disclosure to the Source of Medical Evidence Occasionally in the course of reviewing medical evidence submitted to substantiate a claim, contractor medical personnel may discover a medical condition of which the source of the information is unaware. (For purposes of this section, the ""source"" of the information is the part submitting the evidence.) In cases where a serious or potentially serious condition is found, the contractor may wish to inform the source of the information. If the source of the information indicates that the beneficiary is not institutionalized and the identity of the beneficiary\'s current physician is not known, the source should recommend that the beneficiary consult a physician or institution of the beneficiary\'s choice for further', ""without the specific written consent of that individual, but that the requested information will be sent directly to the individual concerned with an explanation of the inquiry received on their behalf. J. Disclosures to Members of Congress Information requested by members of Congress and their staffs may be disclosed as follows: • Where a member of Congress (or a staff member) inquires on behalf of a constituent, the contractor may respond to the member of Congress (MC) without the written consent of the individual, but must make a record of the disclosure. • Where the MC's inquiry is on behalf of a relative of the subject individual (but the inquirer is not the legal guardian of the individual, or the parent of the individual minor), the contractor should advise the MC that it can respond directly only to the individual unless the individual furnishes written consent to release the""]","No, a person who receives information about an individual with that individual's consent may not authorize disclosure of that information to someone else.",1.0
Can a member of Congress receive information on behalf of a constituent without written consent?,"[""without the specific written consent of that individual, but that the requested information will be sent directly to the individual concerned with an explanation of the inquiry received on their behalf. J. Disclosures to Members of Congress Information requested by members of Congress and their staffs may be disclosed as follows: • Where a member of Congress (or a staff member) inquires on behalf of a constituent, the contractor may respond to the member of Congress (MC) without the written consent of the individual, but must make a record of the disclosure. • Where the MC's inquiry is on behalf of a relative of the subject individual (but the inquirer is not the legal guardian of the individual, or the parent of the individual minor), the contractor should advise the MC that it can respond directly only to the individual unless the individual furnishes written consent to release the"", ""Without Consent, information may not be disclosed without the written consent of the subject individual, or their legal guardian, or, in the case of a minor, their parent (a parent or legal guardian of a minor may not consent to the disclosure of medical information about the minor). Other persons, regardless of relationship (except members of Congress and representative payees), may not receive information about the individual without their consent. In addition, a person who receives information about an individual with the individual's consent may not authorize disclosure of that information to someone else. Awkward situations may develop from a refusal, in compliance with the Privacy Act, to divulge information to the child or spouse of an aged or infirm individual. In order to avoid lengthy and unproductive correspondence, the requester should be advised that the Privacy Act precludes our disclosing any information to anyone other than the individual to whom the information pertains without the specific written consent of that individual, but that the requested information will be sent directly to the individual concerned with an explanation of the inquiry received on their behalf. J. Disclosures to Members of Congress Information requested by members of Congress and their staffs may be disclosed as follows: • Where a member of Congress (or a staff member) inquires on behalf of a constituent, the contractor may respond to the member of Congress (MC) without the written"", ""In each case where a minor's medical records are sent to a physician or health professional, reasonable efforts will be made by the contractor to so inform the minor. In the event the parent or guardian refuses to name a medical professional or cannot afford the fee for the service or the designated medical professional refuses to serve, the contractor will refer the file to the CMS regional office for appropriate action. H. Disclosure to Third Parties The Privacy Act permits disclosure to any third party with the written consent of the individual to whom the record pertains. It also permits disclosure in certain instances without the individual's consent. However, the contractor must not disclose information unless the disclosure is specifically authorized in this chapter, or the individual has consented to the disclosure in writing, or the CMS regional office authorizes the disclosure. I. Disclosures with Consent Except for those disclosures discussed below in §10L of this chapter, Disclosure Without Consent, information may not be disclosed without the written consent of the subject individual, or their legal guardian, or, in the case of a minor, their parent (a parent or legal guardian of a minor may not consent to the disclosure of medical information about the minor). Other persons, regardless of relationship (except members of Congress and representative payees), may not receive information about the individual without their consent. In addition, a person who receives"", ""information about themselves to the MC (if we respond directly to the individual or with their consent, no accounting record is required). Where the inquirer is the legal guardian, or the parent of a minor, the contractor may disclose the information to the MC, but must make a record of the disclosure. • Where the MC's inquiry is in writing and does not indicate whether the request is from the subject individual, the contractor will contact the MC, usually by telephone, to clarify the situation. A copy of the reply (or a report of telephone call if the response is by telephone) will provide an adequate accounting record. The record should show the date of disclosure, the information disclosed, and to whom the disclosure was made. The contractor should file this record by name or social security claim number so that retrieval may be made expeditiously. K. Disclosure to Representative Payees An SSA-appointed representative payee is entitled to receive information on, or act on, behalf of a beneficiary to the extent necessary to protect the beneficiary's rights under title II or XVIII. L. Disclosure without Consent Below are listed the situations in which data on identifiable individuals may be released without the individual's consent. The disclosure is permitted if the disclosure would be: • To DHHS employees and officers who need the records to perform their duties; • Required by the FOIA; • To the Bureau of Census; • For research purposes under certain circumstances; • To"", 'of a beneficiary to the extent necessary to protect the beneficiary\'s rights under title II or XVIII. L. Disclosure without Consent Below are listed the situations in which data on identifiable individuals may be released without the individual\'s consent. The disclosure is permitted if the disclosure would be: • To DHHS employees and officers who need the records to perform their duties; • Required by the FOIA; • To the Bureau of Census; • For research purposes under certain circumstances; • To the National Archives; • For law enforcement activities if the activity is authorized by law and the request is from the head of the agency and specifies the particular record desired and the law enforcement activity for which the record is sought; • For compelling circumstances affecting the health and safety of any person if notice of the disclosure is sent to the last known address of the individual; • To either House of Congress or to any congressional committee or subcommittee (see section I above for requests from members of Congress on behalf of constituents); • To the Comptroller General or an authorized representative to perform the duties of the General Accounting Office; • Pursuant to the order of a court of competent jurisdiction; • For a ""routine use"" - A ""routine use"" is a disclosure of information which may be made without the individual\'s written consent because the disclosure is', ""• Federal or State agencies that need cost report information to carry out requirements of the Social Security Act (e.g., a State health planning agency under title XI (§1122), or a Medicaid State agency under title XIX). The Congress - Requests from Congress are limited to those from the Congress as an official body (e.g., the Speaker of the House or the President of the Senate, or from the chairman of a committee or subcommittee of the House or Senate with jurisdiction related to the information requested). Requests from individual members of the House or Senate are considered requests from the public. 4. Information That Can Be Disclosed CMS's rules limit disclosure to cost report documents that providers are required by regulations and instructions to submit. In the case of a settled cost report, this includes the contractor's notice of program reimbursement. Cost report documents include the statistical page, the settlement pages, trial balance of expenses, cost finding schedules, balance sheet, statement of income and expenses, and other schedules or documents required as part of the regular cost report process. (Where a provider, after first obtaining program approval, submits equivalent documents in lieu of official program documents, such documents are subject to the same disclosure rules as apply to official forms.) Information That May Not Be Disclosed If a provider chooses to submit with its cost report additional information not specifically required by"", 'of a personal representative, the HIPAA Privacy Rule permits a covered entity to disclose to any person identified by the individual the protected health information directly relevant to such person’s involvement with the individual’s care or payment related to the individual’s care. Therefore, a verbal authorization is allowed under the HIPAA Privacy Rule for those individuals involved in the care of an individual. Contractors should continue to handle routine inquiries, such as telephone requests for the status of claims, under existing customer service procedures that include verification of the individual’s identity. Therefore, with the beneficiary’s verbal or written permission, contractors may continue to speak to third parties on behalf of the individual. See Exhibit D - Disclosure Desk Reference Guide for Call Centers for detailed instructions on disclosing PHI over the telephone. Contractors may also continue to handle Congressional inquiries under existing customer service procedures (see §10J above). K. Administrative Requirements As Medicare’s business associate, contractors are not subject to the administrative requirements of the HIPAA Privacy Rule. However, under the Privacy Act, contractors must comply with the privacy provisions specified in their contracts. Contractors are not required to designate a privacy official. However, contractors are required to have in place a senior official or other responsible party to address the privacy concerns of the', 'and activities. Members of Congress, when clearly requesting information on behalf of a constituent or other third party, are subject to the same fees and charges that would apply to the person represented. The contractor will not charge the public for inspection of disclosable documents, or for requests which result in charges under the minimum described in §21.3, below. 21.1 – Fees (Rev. 1, 09-11-02) 1. Fees are to be charged differentially, depending on the category of requester/use of the requested material, as follows: • Commercial Use Request - If the request is for a commercial use, charge the requester for search and review, plus duplication. • Education and Scientific Institutions and News Media - If the requester is (1) an educational institution or a non-commercial scientific institution operated primarily for scholarly or scientific research, or (2) a representative of the news media, charge only for duplication. However, do not charge for the first 100 pages of duplication. • Other Requesters - If the request fits into neither of the above categories, charge for search and duplication. However, do not charge for the first 2 hours of search time and the first 100 pages of duplication. In addition, do not', 'furnish all the information required on a claims form. When information is collected by telephone, the contractor will give the individual a brief oral explanation. When information is requested by mail a written notice is used. E. Method of Accessing Individual Records - General The law requires that an agency must inform an individual, upon request, whether a system of records contains a record pertaining to the individual, permit the individual to review such record and to be accompanied for the purpose of reviewing the record by a person of his or her choice. Further, the individual is permitted to obtain a copy of such record in a comprehensible form at a reasonable cost. There is a charge of 10 cents per page with all fees under $25 waived. There is no charge for searching; nor is there a charge for a copy furnished as a means of permitting an individual access to their records. Each requester shall be asked for proof of identity as well as such general information as is necessary to determine where and how to look for records about the data subject Within 10 working days of receiving a request, the contractor must decide whether to release the records. The requested information must be furnished within 30 working days unless good cause exists. An example of ""good cause"" would be an inactive record filed in a records center that cannot be obtained within 30 days. The requester should be told of the delay and given an approximate date to expect the information. If an', 'A. Non-medical Information Non-medical information about an individual may be disclosed for other than a program purpose, to persons or organizations designated by the individual, if the individual authorizes disclosure, and if disclosure is consistent with the proper and efficient administration of the Act. B. Disclosure of Medical Information to a Physician, Institution, or Other Supplier of Services The contractor may disclose medical information to a supplier of medical services solely for the purpose of the beneficiary\'s care or treatment. Such supplier will be informed that the information is being furnished in connection with the treatment of the beneficiary and that its use should be restricted to that purpose. C. Disclosure to the Source of Medical Evidence Occasionally in the course of reviewing medical evidence submitted to substantiate a claim, contractor medical personnel may discover a medical condition of which the source of the information is unaware. (For purposes of this section, the ""source"" of the information is the part submitting the evidence.) In cases where a serious or potentially serious condition is found, the contractor may wish to inform the source of the information. If the source of the information indicates that the beneficiary is not institutionalized and the identity of the beneficiary\'s current physician is not known, the source should recommend that the beneficiary consult a physician or institution of the beneficiary\'s choice for further']","Yes, a member of Congress (or a staff member) may receive information on behalf of a constituent without the written consent of the individual. The contractor may respond to the member of Congress without the individual's written consent but must make a record of the disclosure. However, if the inquiry is on behalf of a relative of the subject individual and the inquirer is not the legal guardian or parent of a minor, the contractor should advise the member of Congress that it can respond directly only to the individual unless the individual provides written consent.",1.0
What record must be kept when information is disclosed to a member of Congress?,"[""without the specific written consent of that individual, but that the requested information will be sent directly to the individual concerned with an explanation of the inquiry received on their behalf. J. Disclosures to Members of Congress Information requested by members of Congress and their staffs may be disclosed as follows: • Where a member of Congress (or a staff member) inquires on behalf of a constituent, the contractor may respond to the member of Congress (MC) without the written consent of the individual, but must make a record of the disclosure. • Where the MC's inquiry is on behalf of a relative of the subject individual (but the inquirer is not the legal guardian of the individual, or the parent of the individual minor), the contractor should advise the MC that it can respond directly only to the individual unless the individual furnishes written consent to release the"", ""Without Consent, information may not be disclosed without the written consent of the subject individual, or their legal guardian, or, in the case of a minor, their parent (a parent or legal guardian of a minor may not consent to the disclosure of medical information about the minor). Other persons, regardless of relationship (except members of Congress and representative payees), may not receive information about the individual without their consent. In addition, a person who receives information about an individual with the individual's consent may not authorize disclosure of that information to someone else. Awkward situations may develop from a refusal, in compliance with the Privacy Act, to divulge information to the child or spouse of an aged or infirm individual. In order to avoid lengthy and unproductive correspondence, the requester should be advised that the Privacy Act precludes our disclosing any information to anyone other than the individual to whom the information pertains without the specific written consent of that individual, but that the requested information will be sent directly to the individual concerned with an explanation of the inquiry received on their behalf. J. Disclosures to Members of Congress Information requested by members of Congress and their staffs may be disclosed as follows: • Where a member of Congress (or a staff member) inquires on behalf of a constituent, the contractor may respond to the member of Congress (MC) without the written"", ""information about themselves to the MC (if we respond directly to the individual or with their consent, no accounting record is required). Where the inquirer is the legal guardian, or the parent of a minor, the contractor may disclose the information to the MC, but must make a record of the disclosure. • Where the MC's inquiry is in writing and does not indicate whether the request is from the subject individual, the contractor will contact the MC, usually by telephone, to clarify the situation. A copy of the reply (or a report of telephone call if the response is by telephone) will provide an adequate accounting record. The record should show the date of disclosure, the information disclosed, and to whom the disclosure was made. The contractor should file this record by name or social security claim number so that retrieval may be made expeditiously. K. Disclosure to Representative Payees An SSA-appointed representative payee is entitled to receive information on, or act on, behalf of a beneficiary to the extent necessary to protect the beneficiary's rights under title II or XVIII. L. Disclosure without Consent Below are listed the situations in which data on identifiable individuals may be released without the individual's consent. The disclosure is permitted if the disclosure would be: • To DHHS employees and officers who need the records to perform their duties; • Required by the FOIA; • To the Bureau of Census; • For research purposes under certain circumstances; • To"", ""• Federal or State agencies that need cost report information to carry out requirements of the Social Security Act (e.g., a State health planning agency under title XI (§1122), or a Medicaid State agency under title XIX). The Congress - Requests from Congress are limited to those from the Congress as an official body (e.g., the Speaker of the House or the President of the Senate, or from the chairman of a committee or subcommittee of the House or Senate with jurisdiction related to the information requested). Requests from individual members of the House or Senate are considered requests from the public. 4. Information That Can Be Disclosed CMS's rules limit disclosure to cost report documents that providers are required by regulations and instructions to submit. In the case of a settled cost report, this includes the contractor's notice of program reimbursement. Cost report documents include the statistical page, the settlement pages, trial balance of expenses, cost finding schedules, balance sheet, statement of income and expenses, and other schedules or documents required as part of the regular cost report process. (Where a provider, after first obtaining program approval, submits equivalent documents in lieu of official program documents, such documents are subject to the same disclosure rules as apply to official forms.) Information That May Not Be Disclosed If a provider chooses to submit with its cost report additional information not specifically required by"", 'of a beneficiary to the extent necessary to protect the beneficiary\'s rights under title II or XVIII. L. Disclosure without Consent Below are listed the situations in which data on identifiable individuals may be released without the individual\'s consent. The disclosure is permitted if the disclosure would be: • To DHHS employees and officers who need the records to perform their duties; • Required by the FOIA; • To the Bureau of Census; • For research purposes under certain circumstances; • To the National Archives; • For law enforcement activities if the activity is authorized by law and the request is from the head of the agency and specifies the particular record desired and the law enforcement activity for which the record is sought; • For compelling circumstances affecting the health and safety of any person if notice of the disclosure is sent to the last known address of the individual; • To either House of Congress or to any congressional committee or subcommittee (see section I above for requests from members of Congress on behalf of constituents); • To the Comptroller General or an authorized representative to perform the duties of the General Accounting Office; • Pursuant to the order of a court of competent jurisdiction; • For a ""routine use"" - A ""routine use"" is a disclosure of information which may be made without the individual\'s written consent because the disclosure is', 'compatible with the purpose for which the information was collected in the first place. An explanation of the purposes and uses of each ""routine use"" disclosure must be published in the Federal Register at least 30 days prior to the disclosure and at least annually thereafter. Current routine uses are: • Part B Payment Records • Payment Record Reference File • Tape containing amount, type, and cost of health care services. • Summary Records • Group Health Plan Membership Data • Identification Data • Group Health Membership Data • Group Health Membership List • Quality Assurance Program Releases and Corrections M. Accounting for Disclosure The Privacy Act requires that agencies account for disclosures of personal data to organizations outside DHHS or made in response to requests under the FOIA. The purposes of the accounting are: • To allow individuals to learn to whom records about themselves have been disclosed; and • To provide a basis for subsequently advising recipients of any amended or disputed records. The accounting must enable the contractor to tell the individual when and what information about the individual was released and to whom. It is not necessary to maintain a separate record of disclosures if such information can be retrieved from the contractor\'s operating records. An individual has the same access rights to an accounting of disclosures as to other information, with no exception. It is not mandatory to tell an individual about disclosures made to an agency', ""In each case where a minor's medical records are sent to a physician or health professional, reasonable efforts will be made by the contractor to so inform the minor. In the event the parent or guardian refuses to name a medical professional or cannot afford the fee for the service or the designated medical professional refuses to serve, the contractor will refer the file to the CMS regional office for appropriate action. H. Disclosure to Third Parties The Privacy Act permits disclosure to any third party with the written consent of the individual to whom the record pertains. It also permits disclosure in certain instances without the individual's consent. However, the contractor must not disclose information unless the disclosure is specifically authorized in this chapter, or the individual has consented to the disclosure in writing, or the CMS regional office authorizes the disclosure. I. Disclosures with Consent Except for those disclosures discussed below in §10L of this chapter, Disclosure Without Consent, information may not be disclosed without the written consent of the subject individual, or their legal guardian, or, in the case of a minor, their parent (a parent or legal guardian of a minor may not consent to the disclosure of medical information about the minor). Other persons, regardless of relationship (except members of Congress and representative payees), may not receive information about the individual without their consent. In addition, a person who receives"", 'kept confidential (20 CFR Part 405.126). These records may also be subject to State or local laws governing disclosure. Providers are also responsible for following conditions for coverage. A provider or supplier that receives a request for disclosure of information about a Medicare beneficiary, Medicare claim, or related information that it may not disclose, should refer the requestor to the appropriate contractor for further consideration of the request. 170.1 - Disclosure of Health Insurance Information to a Beneficiary or in Connection With a Claim (Rev. 1, 09-11-02)', 'envelope ""Freedom of Information Act Appeal,"" and enclose a copy of this letter. Sincerely yours, Signature of Authorized Official cc: FOI Officer, CMS Process the State or local court subpoena duces tecum that seeks other kinds of CMS records in accord with §10.2 above. C. Penalty for Failure to Comply With the Rules Relating to Disclosure of Information Obtained in the Administration of the Act Section 1106(a) of the Act provides that any person who violates the disclosure provisions shall be deemed guilty of a misdemeanor and, upon conviction thereof, shall be punished by a fine not exceeding $1,000, by imprisonment not exceeding 1 year, or both. 40.2 - The Authority for Disclosure (Rev. 1, 09-11-02) Regulation No. 1 of the Act defines the basic authorization for disclosure of information obtained in the administration of the program. The general rule is that information about an individual obtained in the administration of the program may not be disclosed without the authorization of that individual. Medical information relating to an individual will generally be disclosed under more restrictive conditions than other information and, where permitted, usually may be furnished only upon the written authorization of the individual. Specific exceptions to this rule are detailed in the following sections. As far as program operations are concerned, information about an individual may be disclosed', ""100.3 - Disclosure to Title V and Title XIX Agencies of Information Indicating Unprofessional or Unethical Practices by Physicians and Other Practitioners 100.4 - Disclosure to Title XIX Agencies of Physician Charge Information 100.5 - Electronic Reporting of Crossover Claims 110 - Disclosure to Peer Review Organizations (PROs) 120 - Disclosure to the Internal Revenue Service (Contractors) 130 - Disclosure to the Office for the Civilian Health and Medical Program of the Uniformed Services (TRICARE) by Contractors 130.1 - General 130.2 - Type of Information 130.3 - Procedures for Release 140 - Disclosure of Information About Providers and Suppliers by CMS 140.1 - Disclosure Necessary for Proper Administrative of the Medicare Program (CMS) 140.2 - Disclosure of Medicare Reports 140.3 - Disclosure of Information About Named Physicians and Other Suppliers of Service (RO's) 140.4 - Disclosure of Names of Providers, Physicians, and Suppliers of Services 140.4.1 - Names of Providers Terminated from Program Participation (A/B MACs (B)) or DME MACs 140.4.2 - Names of Providers, Suppliers, and Physicians Found Guilty of Fraud (CMS) 140.4.3 - Names of Physicians on Second Opinion Lists (Contractors) 140.4.4 - Referral to State Licensing Boards, Medical Review Boards, and Professional Societies 140.4.5 - Disclosure of Medicare Statistics 150 - Disclosure of Reports About Named Contractors 150.1 - Disclosure by ROs of Annual Reports of Contractors Performance (RCP) 150.2 - Disclosure of""]","When information is disclosed to a member of Congress (MC), the contractor must make a record of the disclosure. This record should include:

- The date of disclosure
- The information disclosed
- To whom the disclosure was made

The record should be filed by name or social security claim number to allow for expeditious retrieval. Additionally, if the MC's inquiry is on behalf of a constituent, the contractor may respond without the individual's written consent but must still make this record. If the inquiry is on behalf of a relative who is not the legal guardian or parent of a minor, the contractor should advise the MC that disclosure can only be made directly to the individual unless written consent is provided.

A copy of the reply or a report of a telephone call (if the response is by phone) will serve as an adequate accounting record.",1.0
What is an SSA-appointed representative payee entitled to receive?,"['(Rev. 1, 09-11-02) The base premium that is announced by the Secretary is paid by most enrollees. However, it is increased for those who enroll late or reenroll after a prior termination of entitlement. The amount of the increase is 10 percent of the base rate for each full 12- month period during which the individual could have been but was not enrolled in the program. However, months in which an individual has GHP coverage based on current employment status are not counted as months in which the individual ""could have been, but was not enrolled."" This exception does not apply to individuals who are entitled to Medicare on the basis of ESRD. 40.7.3 - Collection of Premiums (Rev. 1, 09-11-02) SMI premiums are collected from benefits payable (in order of priority) by the Railroad Retirement Board, SSA, or Office of Personnel Management (Civil Service) unless the individual is covered under a State buy-in agreement. If the individual is entitled to such benefits but the payments are in suspense, e.g., due to work deductions, he or she is billed for the amounts due. Uninsured beneficiaries are also billed directly for the premiums due. Premium bills are sent every 3 months unless the individual specifically requests a monthly bill or is also entitled to Premium - HI (in which case a monthly combined SMI- Premium-HI bill is sent). 40.7.4 - Grace Period for Payment (Rev. 1, 09-11-02) A grace period has been provided for payment of premiums by those who are billed directly. The', ""information about themselves to the MC (if we respond directly to the individual or with their consent, no accounting record is required). Where the inquirer is the legal guardian, or the parent of a minor, the contractor may disclose the information to the MC, but must make a record of the disclosure. • Where the MC's inquiry is in writing and does not indicate whether the request is from the subject individual, the contractor will contact the MC, usually by telephone, to clarify the situation. A copy of the reply (or a report of telephone call if the response is by telephone) will provide an adequate accounting record. The record should show the date of disclosure, the information disclosed, and to whom the disclosure was made. The contractor should file this record by name or social security claim number so that retrieval may be made expeditiously. K. Disclosure to Representative Payees An SSA-appointed representative payee is entitled to receive information on, or act on, behalf of a beneficiary to the extent necessary to protect the beneficiary's rights under title II or XVIII. L. Disclosure without Consent Below are listed the situations in which data on identifiable individuals may be released without the individual's consent. The disclosure is permitted if the disclosure would be: • To DHHS employees and officers who need the records to perform their duties; • Required by the FOIA; • To the Bureau of Census; • For research purposes under certain circumstances; • To"", ""(Rev. 1, 09-11-02) The following subsections describe premiums paid by other than the enrollee. 40.7.6.1 - Informal Arrangement (Rev. 1, 09-11-02) Enrollees who are being billed directly for Medicare premiums may turn over their premium bills to a friend, relative, employer lodge, union or other organization to pay premiums on their behalf. The third party payer forwards the proper amount of payment for each enrollee to CMS's Premium Collection Center. Enrollees participating in this type of informal arrangement continue to receive their premium notice (Form CMS-500), and remain responsible for assuring that premiums paid on their behalf are paid timely in order to avoid termination of Medicare coverage. 40.7.6.2 - Premium Payer (Rev. 1, 09-11-02) Individuals may be designated as the premium payer for an enrollee and receive the enrollee's premium bills, if it is judged to be in the enrollee's best interest (e.g., the enrollee is competent, but too physically ill or infirm to be able to handle such matters). The individual receiving the premium bill must be a relative or friend showing personal interest in the welfare of the enrollee. 40.7.6.3 - Formal Group Arrangement (Rev. 1, 09-11-02) Employers, religious orders, lodges, unions or other organizations may enter into a formal agreement with CMS in order to receive a single bill and pay a lump sum for the premiums due from a group of individuals. Group payments under a formal group agreement may be made only on behalf of"", 'suspense, e.g., due to work deductions, he or she is billed for the amounts due. Uninsured beneficiaries are also billed directly for the premiums due. Premium bills are sent every 3 months unless the individual specifically requests a monthly bill or is also entitled to Premium - HI (in which case a monthly combined SMI- Premium-HI bill is sent). 40.7.4 - Grace Period for Payment (Rev. 1, 09-11-02) A grace period has been provided for payment of premiums by those who are billed directly. The period extends for 90 days after the month in which the bill is mailed. If the premiums are not received in that prescribed time, entitlement terminates at the end of the grace period. This 90-day grace period for paying overdue SMI premiums and continuing SMI coverage may be extended by CMS for good cause for up to an additional 90 days. Good cause, for example, is found if the enrollee was mentally or physically incapable of paying his or her premiums timely, or had some reasonable basis to believe that payment had been made, or the failure to pay was due to administrative error. 40.7.5 - Payment After Grace Period Applies (Rev. 1, 09-11-02) If an extension to the grace period (additional 90 days; a total not to exceed 180 days) has been granted, an enrollee may retain SMI entitlement by paying all past due premiums if there was a good cause for his/her failure to pay premiums within the initial grace period. 40.7.6 - Premiums Paid by Other Than the Enrollee', '. Uninsuredbeneficiariesarealsobilleddirectlyforthepremiums due . Premiumbillsaresentevery3monthsunlesstheindividualspecificallyrequestsa monthlybillorisalsoentitledtoPremium - HI ( inwhichcaseamonthlycombinedSMI - Premium - HIbillissent ) . 40 . 7 . 4 - GracePeriodforPayment ( Rev . 1 , 09 - 11 - 02 ) Agraceperiodhasbeenprovidedforpaymentofpremiumsbythosewhoarebilled directly . Theperiodextendsfor90daysafterthemonthinwhichthebillismailed . If thepremiumsarenotreceivedinthatprescribedtime , entitlementterminatesattheendof thegraceperiod . This90 - daygraceperiodforpayingoverdueSMIpremiumsand continuingSMIcoveragemaybeextendedbyCMSforgoodcauseforuptoan additional90days . Goodcause , forexample , isfoundiftheenrolleewasmentallyor physicallyincapableofpayinghisorherpremiumstimely , orhadsomereasonablebasis tobelievethatpaymenthadbeenmade , orthefailuretopaywasduetoadministrative error . 40 . 7 . 5 - PaymentAfterGracePeriodApplies ( Rev . 1 , 09 - 11 - 02 ) Ifanextensiontothegraceperiod ( additional90days ; atotalnottoexceed180days ) has beengranted , anenrolleemayretainSMIentitlementbypayingallpastduepremiumsif therewasagoodcauseforhis / herfailuretopaypremiumswithintheinitialgraceperiod . 40 . 7 . 6 - PremiumsPaidbyOtherThantheEnrollee', 'is due for each month of entitlement under SMI. The SMI premium covers about one-fourth of the cost of the Part B program. 40.7.1 - Amount of Premiums (Rev. 1, 09-11-02) In the third quarter of each calendar year, the Secretary of the Department of Health and Human Services announces the base premium for SMI coverage that is payable as of the following January 1. The SMI premium is the same for all enrollees even though the cost to the program is greater for ESRD enrollees and the disabled than it is for the aged. The SMI premium is refigured each year and is based on the lower of one-half of SMI program costs per aged enrollee or the general percentage by which social security benefits were increased during the calendar year in which the announcement occurs. (During the 5-year period, January 1984 through December 1988, the formula for computing the SMI premium has been modified to provide that the Part B premium reflects exactly one-fourth of the cost of the Part B program. Beginning with the premium announced for the period beginning January 1989, however, the method of computing the SMI premium reverts back to the pre-January 1984 rules.) 40.7.2 - Increase in Base Premium Amount', 'the billed charge, the reasonable cost of covered services or the fee schedule amount. Hospices are paid on a per diem amount that is prospectively set. SNFs and HHAs are paid based on a Prospective Payment System (PPS). (See Provider Reimbursement Manual, Part 1, §§2800ff.) Hospitals are paid based on the PPS. Under this system, Medicare payment is made at a predetermined, specific rate for each hospital discharge. This statement applies to inpatient for acute care hospitals and to inpatient rehabilitation hospitals. Whereas inpatient acute and rehab PPS payment is based on the discharge date, Outpatient PPS (OPPS) payments are based on Ambulatory Patient Classification payment for the date of service.', 'Information such as Medicare entitlement or eligibility data may be disclosed to a beneficiary or their authorized representative (this includes the beneficiary\'s representative payee). 170.2 - Disclosure to Contractors (Rev. 1, 09-11-02) Providers and suppliers may not forward medical information to contractors on a confidential basis, expressed, or implied, since, under the Privacy Act, any medical information obtained by a contractor is subject to disclosure to the individual to whom the information pertains or to another person authorized by the individual to have access to it. Some providers and suppliers document findings on medical forms pre-printed ""confidential"" or routinely stamp all records ""confidential"" whether or not such records are ever intended for disclosure to a contractor. The contractor will accept such records only if the provider or supplier accompanies them with a signed statement indicating the following: • That the provider or supplier understands the information is subject to disclosure to the patient under the Privacy Act, and • That any words or statements that the transmitted records are confidential may be disregarded if the patient or the patient\'s representative requests them from the contractor or from CMS. 170.3 - Disclosure to Third parties for Proper Administration of the Health Insurance Program (Rev. 1, 09-11-02) Disclosure by the provider or supplier to persons other than the individual or the individual\'s authorized representative of', 'Security or railroad retirement benefits. The cost of providing Part A benefits to other persons who are not Social Security or railroad retirement beneficiaries is met by appropriations to the Federal Hospital Insurance Trust Fund from general revenues or through premium payments. Part B is financed by monthly premiums of those who voluntarily enroll in the program and by the Federal Government which makes contributions from general revenues. All premiums and Government contributions are deposited in a separate account known as the Federal Supplementary Medical Trust Fund. Money from this fund is used only to pay for Part B benefits and administrative expenses. 20.2 - Discrimination Prohibited (Rev. 28; Issued: 08-12-05; Effective/Implementation: 09-12-05) Participating providers of Part A services under the supplementary medical insurance program (e.g., hospitals, SNFs, HHAs, hospices, outpatient physical therapy, comprehensive outpatient rehabilitation facilities (CORFs), occupational therapy and speech-language pathology providers, and renal dialysis facilities) must comply with the requirements of title VI of the Civil Rights Act of 1964. Under the provisions of that Act, a participating provider is prohibited from making a distinction on the grounds of race, color, or national origin, in the treatment of patients, the use of equipment, other facilities, and the assignment of personnel to provide services. The DHHS is responsible for investigating complaints of', '( Rev . 1 , 09 - 11 - 02 ) ThebasepremiumthatisannouncedbytheSecretaryispaidbymostenrollees . However , itisincreasedforthosewhoenrolllateorreenrollafterapriorterminationof entitlement . Theamountoftheincreaseis10percentofthebaserateforeachfull12 - monthperiodduringwhichtheindividualcouldhavebeenbutwasnotenrolledinthe program . However , monthsinwhichanindividualhasGHPcoveragebasedoncurrent employmentstatusarenotcountedasmonthsinwhichtheindividual "" couldhavebeen , butwasnotenrolled . "" Thisexceptiondoesnotapplytoindividualswhoareentitledto MedicareonthebasisofESRD . 40 . 7 . 3 - CollectionofPremiums ( Rev . 1 , 09 - 11 - 02 ) SMIpremiumsarecollectedfrombenefitspayable ( inorderofpriority ) bytheRailroad RetirementBoard , SSA , orOfficeofPersonnelManagement ( CivilService ) unlessthe individualiscoveredunderaStatebuy - inagreement . Iftheindividualisentitledtosuch benefitsbutthepaymentsareinsuspense , e . g . , duetoworkdeductions , heorsheisbilled fortheamountsdue . Uninsuredbeneficiariesarealsobilleddirectlyforthepremiums due . Premiumbillsaresentevery3monthsunlesstheindividualspecificallyrequestsa monthlybillorisalsoentitledtoPremium - HI ( inwhichcaseamonthlycombinedSMI - Premium - HIbillissent ) . 40 . 7 . 4 - GracePeriodforPayment ( Rev . 1 , 09 - 11 - 02 ) Agraceperiodhasbeenprovidedforpaymentofpremiumsbythosewhoarebilled directly . Theperiodextendsfor90daysafterthemonthinwhichthebillismailed . If thepremiumsarenotreceivedinthatprescribedtime ,']","An SSA-appointed representative payee is entitled to receive information on, or act on, behalf of a beneficiary to the extent necessary to protect the beneficiary's rights under title II or XVIII.",1.0
Name three situations where information may be disclosed without consent.,"[""information about themselves to the MC (if we respond directly to the individual or with their consent, no accounting record is required). Where the inquirer is the legal guardian, or the parent of a minor, the contractor may disclose the information to the MC, but must make a record of the disclosure. • Where the MC's inquiry is in writing and does not indicate whether the request is from the subject individual, the contractor will contact the MC, usually by telephone, to clarify the situation. A copy of the reply (or a report of telephone call if the response is by telephone) will provide an adequate accounting record. The record should show the date of disclosure, the information disclosed, and to whom the disclosure was made. The contractor should file this record by name or social security claim number so that retrieval may be made expeditiously. K. Disclosure to Representative Payees An SSA-appointed representative payee is entitled to receive information on, or act on, behalf of a beneficiary to the extent necessary to protect the beneficiary's rights under title II or XVIII. L. Disclosure without Consent Below are listed the situations in which data on identifiable individuals may be released without the individual's consent. The disclosure is permitted if the disclosure would be: • To DHHS employees and officers who need the records to perform their duties; • Required by the FOIA; • To the Bureau of Census; • For research purposes under certain circumstances; • To"", ""Without Consent, information may not be disclosed without the written consent of the subject individual, or their legal guardian, or, in the case of a minor, their parent (a parent or legal guardian of a minor may not consent to the disclosure of medical information about the minor). Other persons, regardless of relationship (except members of Congress and representative payees), may not receive information about the individual without their consent. In addition, a person who receives information about an individual with the individual's consent may not authorize disclosure of that information to someone else. Awkward situations may develop from a refusal, in compliance with the Privacy Act, to divulge information to the child or spouse of an aged or infirm individual. In order to avoid lengthy and unproductive correspondence, the requester should be advised that the Privacy Act precludes our disclosing any information to anyone other than the individual to whom the information pertains without the specific written consent of that individual, but that the requested information will be sent directly to the individual concerned with an explanation of the inquiry received on their behalf. J. Disclosures to Members of Congress Information requested by members of Congress and their staffs may be disclosed as follows: • Where a member of Congress (or a staff member) inquires on behalf of a constituent, the contractor may respond to the member of Congress (MC) without the written"", ""In each case where a minor's medical records are sent to a physician or health professional, reasonable efforts will be made by the contractor to so inform the minor. In the event the parent or guardian refuses to name a medical professional or cannot afford the fee for the service or the designated medical professional refuses to serve, the contractor will refer the file to the CMS regional office for appropriate action. H. Disclosure to Third Parties The Privacy Act permits disclosure to any third party with the written consent of the individual to whom the record pertains. It also permits disclosure in certain instances without the individual's consent. However, the contractor must not disclose information unless the disclosure is specifically authorized in this chapter, or the individual has consented to the disclosure in writing, or the CMS regional office authorizes the disclosure. I. Disclosures with Consent Except for those disclosures discussed below in §10L of this chapter, Disclosure Without Consent, information may not be disclosed without the written consent of the subject individual, or their legal guardian, or, in the case of a minor, their parent (a parent or legal guardian of a minor may not consent to the disclosure of medical information about the minor). Other persons, regardless of relationship (except members of Congress and representative payees), may not receive information about the individual without their consent. In addition, a person who receives"", 'of a beneficiary to the extent necessary to protect the beneficiary\'s rights under title II or XVIII. L. Disclosure without Consent Below are listed the situations in which data on identifiable individuals may be released without the individual\'s consent. The disclosure is permitted if the disclosure would be: • To DHHS employees and officers who need the records to perform their duties; • Required by the FOIA; • To the Bureau of Census; • For research purposes under certain circumstances; • To the National Archives; • For law enforcement activities if the activity is authorized by law and the request is from the head of the agency and specifies the particular record desired and the law enforcement activity for which the record is sought; • For compelling circumstances affecting the health and safety of any person if notice of the disclosure is sent to the last known address of the individual; • To either House of Congress or to any congressional committee or subcommittee (see section I above for requests from members of Congress on behalf of constituents); • To the Comptroller General or an authorized representative to perform the duties of the General Accounting Office; • Pursuant to the order of a court of competent jurisdiction; • For a ""routine use"" - A ""routine use"" is a disclosure of information which may be made without the individual\'s written consent because the disclosure is', 'A. Non-medical Information Non-medical information about an individual may be disclosed for other than a program purpose, to persons or organizations designated by the individual, if the individual authorizes disclosure, and if disclosure is consistent with the proper and efficient administration of the Act. B. Disclosure of Medical Information to a Physician, Institution, or Other Supplier of Services The contractor may disclose medical information to a supplier of medical services solely for the purpose of the beneficiary\'s care or treatment. Such supplier will be informed that the information is being furnished in connection with the treatment of the beneficiary and that its use should be restricted to that purpose. C. Disclosure to the Source of Medical Evidence Occasionally in the course of reviewing medical evidence submitted to substantiate a claim, contractor medical personnel may discover a medical condition of which the source of the information is unaware. (For purposes of this section, the ""source"" of the information is the part submitting the evidence.) In cases where a serious or potentially serious condition is found, the contractor may wish to inform the source of the information. If the source of the information indicates that the beneficiary is not institutionalized and the identity of the beneficiary\'s current physician is not known, the source should recommend that the beneficiary consult a physician or institution of the beneficiary\'s choice for further', ""• An officer or employee of a State agency when necessary to carry out their duties under State law in the licensing or approving of hospitals, skilled nursing facilities, home health agencies, or independent laboratories, etc. Information obtained in the provider certification process is not to be disclosed to those not included in the above three categories, except as indicated in §140.3 below. However, information that a particular institution is participating in the program may be released; and information indicating the specialties for which title XVIII payment may be made for services of a particular independent laboratory may be released. This information is usually available from the Directory of Medical Providers and Suppliers of Services published by the Government Printing Office. C. Contractors' Disclosure to Third Parties Disclosure to third parties for program purposes of information about identifiable physicians and other suppliers who are natural persons is governed by the same restrictions and procedures as disclosure about named beneficiaries to third parties for program purposes. (See §50 of this chapter.) Information about unidentifiable individuals or about providers or corporate entities (e.g., clinics or independent laboratories), is not exempt from disclosure by section 1106 and regulations at 42 CFR, Part 401. However, it is not to be disclosed by third parties to which information is disclosed for program purposes. If the information the contractor"", ""is subject to disclosure to the patient under the Privacy Act, and • That any words or statements that the transmitted records are confidential may be disregarded if the patient or the patient's representative requests them from the contractor or from CMS. 170.3 - Disclosure to Third parties for Proper Administration of the Health Insurance Program (Rev. 1, 09-11-02) Disclosure by the provider or supplier to persons other than the individual or the individual's authorized representative of any records, reports, or other information about the individual is authorized without the individual's or their representative's consent under the following circumstances: The disclosure is required in connection with any claim or other proceeding under the Social Security Act for the proper performance of the duties of: • Any officer or employee of the Department; or • Any officer or employee of a State agency, A/B MAC (A or HHH), provider of services, or other agency or organization participating in the administration of the program, by contract or agreement, in carrying out such contract or agreement. These limitations apply whether or not the individual to whom the information pertains authorizes further disclosure to third parties (e.g., to a private medical plan)."", 'that it discloses no information which would appear to be detrimental to the individual or the individual\'s estate, i.e., unusual place or manner of death or information which could create a liability to the individual\'s estate. The contractor may disclose medical information, in form and detail consistent with proper and efficient administration of the program, when such disclosure is reasonably necessary for a title XVIII purpose. (See §50 of this chapter for further information concerning the disclosure of non-medical and medical information when necessary for a program purpose.) The contractor may disclose medical information obtained in the administration of title XVIII to a surviving relative or legal representative of the estate of the individual or to others for other than a title XVIII purpose, when such information is necessary for a determination as to what supplementary benefits or services such deceased individual was eligible to receive under a private or public hospital or medical insurance program which is consistent with the purposes and objectives of title XVIII. The contractor may disclose such information only if the individual has consented to such disclosure or a surviving relative or the legal representative of the estate consents. (See §80.1 ""Release of Title XVIII Claims Information for Complementary Insurance Purposes"" in this chapter.) 80 - Disclosure to Third Parties for Other than Program Purposes (Contractors) (Rev. 1, 09-11-02)', ""without the individual's authorization when the disclosure is necessary in connection with any claim, or other proceeding, under the Social Security Act. Information will be disclosed for other than program purposes only if the disclosure is authorized by Regulation No. 1 and is consistent with the proper and efficient administration of the program. 50 - Disclosure Necessary for Proper Administration of the Health Insurance Program (Rev. 1, 09-11-02) A. Information About an Individual Disclosure of any record, report, or information about an individual may be made without the individual's authorization if it is in connection with any claim, or other proceeding, under the Act when it is necessary for the proper performance of duties of: • Any officer or employee of the Department; or • Any officer or employee of a State agency, contractor, provider of services, or other agency or organization participating in the administration of the program by contract or agreement in carrying out such contract or agreement. The SSOs have a responsibility for public information activities. In its development of a human interest story concerning health insurance, an SSO may, on occasion, request the contractor to provide claims reimbursement information about a specific beneficiary. The contractor will honor such a request when it comes from an SSO employee having authority for liaison with the contractor. Depending upon the agreements made with the parallel SSO, the employee authorized may"", ""provider, physician or supplier understands that the information is subject to disclosure at the request of the patient or his/her representative under the Privacy Act. 2. Release of Eligibility Data to Providers and Suppliers When the Individual is Unable to Sign an Authorization In situations such as the admission to a hospital of an unconscious person, where the individual has not signed a statement authorizing the provider to pursue a Medicare claim, the disclosure of Medicare information to the provider should be treated as a routine use disclosure. If the individual has authorized the provider or supplier to pursue a Medicare claim, the release of information may be treated as a disclosure made with the beneficiary's consent. 10.1 - Disclosure of Information (Rev. 1, 09-11-02)""]","Three situations where information may be disclosed without the individual's consent are:

1. To DHHS employees and officers who need the records to perform their duties.
2. When required by the Freedom of Information Act (FOIA).
3. For law enforcement activities if authorized by law, with a request from the head of the agency specifying the record and the law enforcement activity.

Other situations include disclosure to the Bureau of Census, for research purposes under certain circumstances, to the National Archives, to Congress or congressional committees, to the Comptroller General, pursuant to a court order, and for compelling health and safety circumstances with notice to the individual.",1.0
